grammatical,ungrammatical
"Den bestäms i många fall inte heller enbart eller ens i övervägande grad av familjestrukturen, utan personlighetsdrag hos makarna har stor betydelse.","Den bestäms i många fall inte heller enbart eller ens i övervägande grad av familjestrukturen, utan personlighetsdrag hos makarna ha stor betydelse."
"Det var så Jove hade sagt för några månader sedan när han hade hållit mig om handleden, alltför hårt, över ett restaurangbord.","Det vara så Jove hade sagt för några månader sedan när han hade hållit mig om handleden, alltför hårt, över ett restaurangbord."
Och så tröttnade jag på det också.,Och så tröttna jag på det också.
Det innebär alltså att man motsvarande det skadade området får en ökad strålning i jämförelse med den omkringliggande vävnaden och att denna skillnad mellan abnorm och normal vävnad kan iakttagas med hjälp av gammakameran.,Det innebära alltså att man motsvarande det skadade området får en ökad strålning i jämförelse med den omkringliggande vävnaden och att denna skillnad mellan abnorm och normal vävnad kan iakttagas med hjälp av gammakameran.
De flesta bilar är i dag redan från fabriken utrustade med radialdäck.,De flesta bilar vara i dag redan från fabriken utrustade med radialdäck.
"Jag följer med dig, sa hon.","Jag följa med dig, sa hon."
"Tidsfristen för ändringsförslag har nämligen gått ut, och det betyder att om vi inte röstar så försummar vi att göra vår mening hörd.","Tidsfristen för ändringsförslag ha nämligen gått ut, och det betyder att om vi inte röstar så försummar vi att göra vår mening hörd."
Exempel kan också hämtas från fiskarna och däggdjuren.,Exempel kunna också hämtas från fiskarna och däggdjuren.
Dobby gav honom en tragisk blick.,Dobby ge honom en tragisk blick.
"Jag gav i artiga ordalag uttryck åt en förhoppning om att den andra inställningen, den revolutionära, inte skulle överges.","Jag ge i artiga ordalag uttryck åt en förhoppning om att den andra inställningen, den revolutionära, inte skulle överges."
"Hon sade det med en liten halvt frågande axelryckning, ett erkännande av falskheten i ett annat slags vardagsfraser i ett annat tidsskede.","Hon säga det med en liten halvt frågande axelryckning, ett erkännande av falskheten i ett annat slags vardagsfraser i ett annat tidsskede."
"Han var sjaskigt och vårdslöst klädd, med bläckfläckar på kavajärmarna, och nedanför hakan, som till formen påminde om en stöveltå, fladdrade en yvig halsduk.","Han vara sjaskigt och vårdslöst klädd, med bläckfläckar på kavajärmarna, och nedanför hakan, som till formen påminde om en stöveltå, fladdrade en yvig halsduk."
Också för vårt beteende i övrigt spelar den sociala miljöns karaktär en viss roll.,Också för vårt beteende i övrigt spela den sociala miljöns karaktär en viss roll.
"Med moderna metoder kan man få ungefär en fjärdedel av de schizofrena nästan helt återställda och hälften någorlunda förbättrade, medan en fjärdedel blir kroniskt sjuka och därvid alltmer psykiskt avtrubbade.","Med moderna metoder kunna man få ungefär en fjärdedel av de schizofrena nästan helt återställda och hälften någorlunda förbättrade, medan en fjärdedel blir kroniskt sjuka och därvid alltmer psykiskt avtrubbade."
Därefter finns uppgifter om postnummer för fack- och boxadresser vid varje särskild adresspostanstalt.,Därefter finnas uppgifter om postnummer för fack- och boxadresser vid varje särskild adresspostanstalt.
Det dröjde över en månad innan jag fick se den stora flodens mynning.,Det dröja över en månad innan jag fick se den stora flodens mynning.
De följde med blicken fjärilarna nere bland tobaksblommorna.,De följa med blicken fjärilarna nere bland tobaksblommorna.
Genom en ökad effektiv information kan vi kanske i någon mån göra äktenskapet mer attraktivt.,Genom en ökad effektiv information kunna vi kanske i någon mån göra äktenskapet mer attraktivt.
Majoriteten gör det inte.,Majoriteten göra det inte.
"Alla lärarna har gullegrisar, den där Hermione Granger","Alla lärarna ha gullegrisar, den där Hermione Granger"
"Förvärvsavdrag kan medges från A-inkomst, om det finns hemmavarande barn under 16 år.","Förvärvsavdrag kunna medges från A-inkomst, om det finns hemmavarande barn under 16 år."
Detta har medfört hyressplittring.,Detta ha medfört hyressplittring.
Man förebrår inte ens de fäder som har extraknäck och nästan aldrig träffar sina barn.,Man förebrå inte ens de fäder som har extraknäck och nästan aldrig träffar sina barn.
Tänk på att Don Quijote boken igenom oroar sig över sitt eftermäle.,Tänk på att Don Quijote boken igenom oroa sig över sitt eftermäle.
Andra biotekniska metoder av stort intresse är de som under senare år framkommit för att utvinna fett och protein ur bergolja.,Andra biotekniska metoder av stort intresse vara de som under senare år framkommit för att utvinna fett och protein ur bergolja.
"Ett annat är Lergigan, som användes mot sjösjuka och allergier men också som lugnande medel och sömnmedel.","Ett annat vara Lergigan, som användes mot sjösjuka och allergier men också som lugnande medel och sömnmedel."
Han slängde på luren så häftigt att plasten sprack.,Han slänga på luren så häftigt att plasten sprack.
Bristyrkesutbildningen avser att snabbt öka tillgången på yrkeskunnigt folk inom vissa branscher med efterfrågan på personal.,Bristyrkesutbildningen avse att snabbt öka tillgången på yrkeskunnigt folk inom vissa branscher med efterfrågan på personal.
"Han kunde resa nånstans om han ville, till och med åka utomlands ett tag.","Han kunna resa nånstans om han ville, till och med åka utomlands ett tag."
Det är då EEC tar ställning till de fortsatta förhandlingarna med Sverige.,Det vara då EEC tar ställning till de fortsatta förhandlingarna med Sverige.
"Det är på männens medverkan det beror, om vi skall komma så värst mycket längre.","Det vara på männens medverkan det beror, om vi skall komma så värst mycket längre."
Jag har varit borta länge.,Jag ha varit borta länge.
Livsstilar och meningar bryter sig inte bara människor emellan utan lika mycket inom den enskilda individen.,Livsstilar och meningar bryta sig inte bara människor emellan utan lika mycket inom den enskilda individen.
Tyngdpunkten i samhällets ansvar för den enskilde medborgarens ekonomiska trygghet ligger i socialförsäkringarna.,Tyngdpunkten i samhällets ansvar för den enskilde medborgarens ekonomiska trygghet ligga i socialförsäkringarna.
Följande lista visar resultatet av varje läge.,Följande lista visa resultatet av varje läge.
"När chassiden återvänder till sin plats efter bönen berättar jag för honom att min hustru, en lärd kvinna, skall föreläsa på Hebreiska universitetet i Jerusalem.","När chassiden återvända till sin plats efter bönen berättar jag för honom att min hustru, en lärd kvinna, skall föreläsa på Hebreiska universitetet i Jerusalem."
"Han talade till den ålderstigna engelska prinsessan som satt bredvid honom med knäna sedligt tryckta mot varandra i den kungliga ställning som är säreget karakteristisk för genomlidandet av ceremonier, och Bray såg hur han pekade ut skaran av galakvinnor som stod uppställda med ansikten och bröst målade i glädjevitt bland grupperna av musikanter och dansare från olika delar av landet.","Han tala till den ålderstigna engelska prinsessan som satt bredvid honom med knäna sedligt tryckta mot varandra i den kungliga ställning som är säreget karakteristisk för genomlidandet av ceremonier, och Bray såg hur han pekade ut skaran av galakvinnor som stod uppställda med ansikten och bröst målade i glädjevitt bland grupperna av musikanter och dansare från olika delar av landet."
Det var som om hon hade känt till allt om dem och om mig med.,Det vara som om hon hade känt till allt om dem och om mig med.
Det betyder rimligen ofta borgerlig vigsel istället för kyrklig.,Det betyda rimligen ofta borgerlig vigsel istället för kyrklig.
"En ny bricka kom ut under träden, den här gången lastad med whisky och gin.","En ny bricka komma ut under träden, den här gången lastad med whisky och gin."
Du skapar SQL-frågor i något av två ANSI SQL-frågelägen:,Du skapa SQL-frågor i något av två ANSI SQL-frågelägen:
"Moster Petunia grävde fram lite glass ur frysen och Harry, som fortfarande darrade i hela kroppen, började skura rent köket.","Moster Petunia gräva fram lite glass ur frysen och Harry, som fortfarande darrade i hela kroppen, började skura rent köket."
"Hur som helst så fanns den inte på platsen, och som det inte var troligt att den skulle anlända från Europa kunde jag inte få klart för mig vad han väntade på.","Hur som helst så finnas den inte på platsen, och som det inte var troligt att den skulle anlända från Europa kunde jag inte få klart för mig vad han väntade på."
Han klampade ut ur rummet på platta fötter.,Han klampa ut ur rummet på platta fötter.
Det verkar som om samhället sent omsider tycks inse att betydligt mer måste göras för att underlätta kvinnans samtidiga moderskap och förvärvsarbete.,Det verka som om samhället sent omsider tycks inse att betydligt mer måste göras för att underlätta kvinnans samtidiga moderskap och förvärvsarbete.
"Han var mycket, mycket orolig, sa han.","Han vara mycket, mycket orolig, sa han."
Det ofördelaktigaste man kunde säga om honom var att han inte var trogen sin typ.,Det ofördelaktigaste man kunna säga om honom var att han inte var trogen sin typ.
"Det hade varit så många dröjsmål redan, så han visste inte vilka som var döda och vilka som levde och hur de klarade sig – och så vidare och så vidare.","Det ha varit så många dröjsmål redan, så han visste inte vilka som var döda och vilka som levde och hur de klarade sig – och så vidare och så vidare."
För väljare som har svårt att komma till vallokalen ordnar vissa kommuner valskjutsar.,För väljare som ha svårt att komma till vallokalen ordnar vissa kommuner valskjutsar.
Det var inte första gången ett gräl hade utbrutit vid frukosten i nummer fyra på Privet Drive.,Det vara inte första gången ett gräl hade utbrutit vid frukosten i nummer fyra på Privet Drive.
Fast om man tjänade 8 kronor i timmen kanske man skulle orka vara glad...,Fast om man tjäna 8 kronor i timmen kanske man skulle orka vara glad...
"År 1920, och först då, fick den gifta kvinnan fullständig myndighet.","År 1920, och först då, få den gifta kvinnan fullständig myndighet."
Tvärs över stod det med snirkliga guldbokstäver: Gyllenroy Lockmans råd angående ohyra i hemmet.,Tvärs över stå det med snirkliga guldbokstäver: Gyllenroy Lockmans råd angående ohyra i hemmet.
Om bara den ena maken vill ha hemskillnad måste han eller hon stämma den andra inför domstol.,Om bara den ena maken vilja ha hemskillnad måste han eller hon stämma den andra inför domstol.
En huvudtes i kibbutzideologin är fullständig jämställdhet mellan könen.,En huvudtes i kibbutzideologin vara fullständig jämställdhet mellan könen.
"Nog törs vi t ex ifrågasätta om alla våra bostadsområden måste se ut som de gör: travar med likadana topputrustade enheter centrerade kring snabbköp, kiosk och parkeringsplats?","Nog töras vi t ex ifrågasätta om alla våra bostadsområden måste se ut som de gör: travar med likadana topputrustade enheter centrerade kring snabbköp, kiosk och parkeringsplats?"
"Nästa morgon berättade min far för mig att vi hade uppfångat en okänd signal, som förmodades komma från en båt alldeles framför oss, men ingenting hade påträffats.","Nästa morgon berätta min far för mig att vi hade uppfångat en okänd signal, som förmodades komma från en båt alldeles framför oss, men ingenting hade påträffats."
När Office Web Components har installerats kan användare som har en Office XP-licens samverka med komponenterna och ändra dem.,När Office Web Components ha installerats kan användare som har en Office XP-licens samverka med komponenterna och ändra dem.
Däremot har familjen fortfarande en allmän känslomässig funktion.,Däremot ha familjen fortfarande en allmän känslomässig funktion.
Kriminologerna har sammanställt de senaste årens antal inrapporterade sådana fall och jämfört dem med en kriminalstatistik över de senaste tio åren.,Kriminologerna ha sammanställt de senaste årens antal inrapporterade sådana fall och jämfört dem med en kriminalstatistik över de senaste tio åren.
Det beror på flera omständigheter.,Det bero på flera omständigheter.
Med demokrati menas att medborgarna utser riksdagen i allmänna och fria val.,Med demokrati menas att medborgarna utse riksdagen i allmänna och fria val.
Också på detta område möter vi den ständigt återkommande klyftan mellan rika industriländer och fattiga u-länder.,Också på detta område möta vi den ständigt återkommande klyftan mellan rika industriländer och fattiga u-länder.
Men därmed var Europa slut.,Men därmed vara Europa slut.
Vilken var egentligen drivkraften bakom detta program?,Vilken vara egentligen drivkraften bakom detta program?
Bakgrunden till beslutet att satsa pengar på oljeletning i Skåne och Östersjön är bl a att Sverige importerar petroleum för 3-4 miljarder kronor årligen.,Bakgrunden till beslutet att satsa pengar på oljeletning i Skåne och Östersjön vara bl a att Sverige importerar petroleum för 3-4 miljarder kronor årligen.
Wentz satte ifrån sig sitt glas bredvid stolen för att dra hela uppmärksamheten till det uttalande som han nu skulle göra.,Wentz sätta ifrån sig sitt glas bredvid stolen för att dra hela uppmärksamheten till det uttalande som han nu skulle göra.
Jag visste inte att min mor kunde springa.,Jag veta inte att min mor kunde springa.
"En familje-egoism som bl.a. innebär att familjen vänder samhället ryggen, indifferent till dess sociala och politiska problematik, upptagen av att erövra en plats i solen åt sina egna medlemmar.","En familje-egoism som bl.a. innebära att familjen vänder samhället ryggen, indifferent till dess sociala och politiska problematik, upptagen av att erövra en plats i solen åt sina egna medlemmar."
"Den jag såg här saknade ansikte, som om den alltjämt höll på att skapas, och erbjöd en dyster och enformig anblick.","Den jag se här saknade ansikte, som om den alltjämt höll på att skapas, och erbjöd en dyster och enformig anblick."
Särskilt mörkerkörning ställer höga krav på synen.,Särskilt mörkerkörning ställa höga krav på synen.
"Det finns också en särskild indexnämnd med representanter för staten, arbetsmarknadsparterna och konsumenterna som har inflytande på dessa kvalitetsvärderingar.","Det finnas också en särskild indexnämnd med representanter för staten, arbetsmarknadsparterna och konsumenterna som har inflytande på dessa kvalitetsvärderingar."
Det är här som diskussionen kört fast.,Det vara här som diskussionen kört fast.
Man gav lån och bidrag för att förbättra undermåliga bostäder på landsbygden.,Man ge lån och bidrag för att förbättra undermåliga bostäder på landsbygden.
"Och han stegade i väg med långa kliv, huvudet och axlarna högre än någon annan i folkmyllret på gatan.","Och han stega i väg med långa kliv, huvudet och axlarna högre än någon annan i folkmyllret på gatan."
"De regeringar, som nu i den här situationen uppmanar till ytterligare produktionsökningar, handlar ansvarslöst.","De regeringar, som nu i den här situationen uppmana till ytterligare produktionsökningar, handlar ansvarslöst."
John går sällan till sjöss numera.,John gå sällan till sjöss numera.
På en del ställen får man använda kemtoaletter och sedan dumpa avfallet inom vissa öppna vattenområden.,På en del ställen få man använda kemtoaletter och sedan dumpa avfallet inom vissa öppna vattenområden.
(Ordföranden avbröt talaren).,(Ordföranden avbryta talaren).
När du öppnar en Access-fil och Access inte hittar en referensfil på den sökväg som anges söker Access efter referensen enligt nedan.,När du öppna en Access-fil och Access inte hittar en referensfil på den sökväg som anges söker Access efter referensen enligt nedan.
"Vi parkerade, trots att vi var den enda bilen på den vägsträckan, och började sakta promenera hand i hand genom några lätt fladdrande avspärrningar av papper och tråd.","Vi parkera, trots att vi var den enda bilen på den vägsträckan, och började sakta promenera hand i hand genom några lätt fladdrande avspärrningar av papper och tråd."
Men känner du dig trött - ta en paus på en parkerings- eller rastplats.,Men känna du dig trött - ta en paus på en parkerings- eller rastplats.
Jag såg deras tårstrimmiga ansikten ångestfyllt tryckas mot bilens fönster och vindruta.,Jag se deras tårstrimmiga ansikten ångestfyllt tryckas mot bilens fönster och vindruta.
Valarnas ljudkommunikation når ultraljudområdet.,Valarnas ljudkommunikation nå ultraljudområdet.
På valförrättarens bord står valboxen.,På valförrättarens bord stå valboxen.
"Fiskodling i dammar och grunda lagunområden ökar tillgången på proteinrik föda i de tätast befolkade områdena av världen, t.ex. Kina och Indonesien, men även i tropiska Afrika.","Fiskodling i dammar och grunda lagunområden öka tillgången på proteinrik föda i de tätast befolkade områdena av världen, t.ex. Kina och Indonesien, men även i tropiska Afrika."
Sov en stund eller rör på dig i friska luften.,Sov en stund eller röra på dig i friska luften.
Jag kände på mig att far hade sökt sin död.,Jag känna på mig att far hade sökt sin död.
Hur bestämmelserna än är finns det dock vid marina-anläggningarna uppsamlingstankar och pumpstationer med anslutningar vid bryggorna för utsugning av avfallet.,Hur bestämmelserna än vara finns det dock vid marina-anläggningarna uppsamlingstankar och pumpstationer med anslutningar vid bryggorna för utsugning av avfallet.
"Det som riktigt är jag själv - o hemska verklighet! - skall, enligt bibelns lära om kärlek, varken blomma ut i någon sorts självständighet eller gömmas under någon annans dominans.","Det som riktigt vara jag själv - o hemska verklighet! - skall, enligt bibelns lära om kärlek, varken blomma ut i någon sorts självständighet eller gömmas under någon annans dominans."
Han rullar sig i sin egen urin och gnider sig mot trädstammen.,Han rulla sig i sin egen urin och gnider sig mot trädstammen.
Men tendensen att signalera och ge svar ärvs från generation till generation och är därmed föremål för en evolution på samma sätt som andra ärftliga egenskaper.,Men tendensen att signalera och ge svar ärvs från generation till generation och vara därmed föremål för en evolution på samma sätt som andra ärftliga egenskaper.
Vad inbillar ni er?,Vad inbilla ni er?
Vivien fick tag på en snickare.,Vivien få tag på en snickare.
"Det hade burit alla de fartyg vilkas namn glimmar till som ädelstenar i tidens natt, alltifrån Golden Hind som kom åter med sitt bukiga skrov fyllt av skatter för att inspekteras av en hög drottning och sålunda göra sitt utträde ur den väldiga sagan, intill Erebus och Terror som seglade ut på ett annat erövringståg – och som aldrig kom åter.","Det ha burit alla de fartyg vilkas namn glimmar till som ädelstenar i tidens natt, alltifrån Golden Hind som kom åter med sitt bukiga skrov fyllt av skatter för att inspekteras av en hög drottning och sålunda göra sitt utträde ur den väldiga sagan, intill Erebus och Terror som seglade ut på ett annat erövringståg – och som aldrig kom åter."
Han var i desperat behov av att få säga Jag är olycklig.,Han vara i desperat behov av att få säga Jag är olycklig.
"Därför finns det för varje ort i del 2 ett särskilt postnummer, samlingsnummer, som man kan använda i sådana fall.","Därför finnas det för varje ort i del 2 ett särskilt postnummer, samlingsnummer, som man kan använda i sådana fall."
"Tyvärr tyder mycket på, att full demokrati i äktenskapet ännu är mer undantagsfall än regel.","Tyvärr tyda mycket på, att full demokrati i äktenskapet ännu är mer undantagsfall än regel."
Sen har många nya vindar blåst.),Sen ha många nya vindar blåst.)
"Du sätter in hela din skatteåterbäring, eller en del av den, på ett premiesparkonto.","Du sätta in hela din skatteåterbäring, eller en del av den, på ett premiesparkonto."
"Dessa var hans lyckligaste stunder, stunderna då han var klar med pappersarbetet, då han kunde höra sin sekreterare hamra på sin Remington som vore den ett kyrkpiano.","Dessa vara hans lyckligaste stunder, stunderna då han var klar med pappersarbetet, då han kunde höra sin sekreterare hamra på sin Remington som vore den ett kyrkpiano."
Meningarna därom är delade.,Meningarna därom vara delade.
Följande bild visar en pivottabellista på dataåtkomstsidan Order.,Följande bild visa en pivottabellista på dataåtkomstsidan Order.
"Bruttonationalprodukten (det totala värdet av vad ett land producerar i fråga om varor och tjänster) har ökat med 67 proc åren 1958-1968 i EEC, med 58 proc. i USA.","Bruttonationalprodukten (det totala värdet av vad ett land producera i fråga om varor och tjänster) har ökat med 67 proc åren 1958-1968 i EEC, med 58 proc. i USA."
Fast mycket kanske beror på en själv.,Fast mycket kanske bero på en själv.
"Vissa lättare psykiska symptom anses normala under en graviditet, säger Åke Nilsson.","Vissa lättare psykiska symptom anses normala under en graviditet, säga Åke Nilsson."
"Svårt att gissa, förklarar jag.","Svårt att gissa, förklara jag."
"Det var som ett ljudlöst skratt, en vits som avbrutits strax före poängen, en munterhet utan vare sig orsak eller riktning.","Det vara som ett ljudlöst skratt, en vits som avbrutits strax före poängen, en munterhet utan vare sig orsak eller riktning."
Det luktade brinnande trä;,Det lukta brinnande trä;
Många är motståndare till att ha en hund i staden.,Många vara motståndare till att ha en hund i staden.
Kunde han bara ge upp alltihop så där utan vidare?,kunna han bara ge upp alltihop så där utan vidare?
Det är också en viktig samhällsinsats.,Det vara också en viktig samhällsinsats.
"Eller finns det numera här i världen en naturlig förståelse för revolutionen, för massans organisation, för kadrer, polisstyre och hemliga regeringsorgan?","Eller finnas det numera här i världen en naturlig förståelse för revolutionen, för massans organisation, för kadrer, polisstyre och hemliga regeringsorgan?"
Jag var inte van att skaffa mig saker och ting på det sättet.,Jag vara inte van att skaffa mig saker och ting på det sättet.
"Fick de andra arbetstider skulle de trivas bättre och fungera bättre och därför är det på tiden att man gör ett försök, exempelvis inom processindustrin, att variera arbetstiderna.","få de andra arbetstider skulle de trivas bättre och fungera bättre och därför är det på tiden att man gör ett försök, exempelvis inom processindustrin, att variera arbetstiderna."
"Man vill inte binda sig, (ofta bara en part).","Man vilja inte binda sig, (ofta bara en part)."
"Om det gäller statsministern, avgår hela regeringen, eller utlyses nyval inom en vecka.","Om det gälla statsministern, avgår hela regeringen, eller utlyses nyval inom en vecka."
Då behöver inte annat skäl uppges än att de är överens om att inte fortsätta att leva tillsammans.,Då behöva inte annat skäl uppges än att de är överens om att inte fortsätta att leva tillsammans.
"Bruksdammen finns kvar, liksom slottet, parken, kvarnen, klockstapeln, förvaltarbostaden m.m..","Bruksdammen finnas kvar, liksom slottet, parken, kvarnen, klockstapeln, förvaltarbostaden m.m.."
Adressen brukar finnas i telefonkatalogen.,Adressen bruka finnas i telefonkatalogen.
Som du ser ut! sade Hagrid barskt och borstade av sot från Harry med en kraft som nästan fick honom att åka på huvudet ner i en tunna med drakgödsel utanför apoteket.,Som du se ut! sade Hagrid barskt och borstade av sot från Harry med en kraft som nästan fick honom att åka på huvudet ner i en tunna med drakgödsel utanför apoteket.
"Koschermat är dyrare än andra sorter, säger jag.","Koschermat vara dyrare än andra sorter, säger jag."
"I dag garanterar Folkhälsan och Naturvårdsverket att larmrapporten om gifthalten fått överdrivna proportioner - strömming, lax och ål är helt riskfritt att äta.","I dag garantera Folkhälsan och Naturvårdsverket att larmrapporten om gifthalten fått överdrivna proportioner - strömming, lax och ål är helt riskfritt att äta."
"Men det är viktigt, att förlusterna inte blir onödigt stora.","Men det vara viktigt, att förlusterna inte blir onödigt stora."
Får jag slå mig ner?,få jag slå mig ner?
"Men vi vill också skapa ytterligare stimulans, exempelvis genom ensamrätt på marknaden för tio år.","Men vi vilja också skapa ytterligare stimulans, exempelvis genom ensamrätt på marknaden för tio år."
Men det där är ju en sak dem emellan.,Men det där vara ju en sak dem emellan.
Centralens sköterska gör besök i hemmen för hjälp och råd när det gäller skötsel av barn.,Centralens sköterska göra besök i hemmen för hjälp och råd när det gäller skötsel av barn.
Det kan alltså bero på om man bor tjugo meter på ena eller andra sidan av en kommungräns då man behöver socialhjälp.,Det kunna alltså bero på om man bor tjugo meter på ena eller andra sidan av en kommungräns då man behöver socialhjälp.
