grammatical,ungrammatical
Åtminstone en del av dem förstör vissa monoaminer eller hindrar dem från att verka.,Åtminstone en del av dem förstöra vissa monoaminer eller hindrar dem från att verka.
"Vi ska flytta till London, sa han.","Vi skola flytta till London, sa han."
Efter 100 timmar har glödlamporna tappat halva effekten!,Efter 100 timmar ha glödlamporna tappat halva effekten!
"Andra åter anser att denna metod inte löser bostadsfrågorna, endast maskerar den.","Andra åter anse att denna metod inte löser bostadsfrågorna, endast maskerar den."
Detta ställer stora krav på upplysning.,Detta ställa stora krav på upplysning.
Varför stirrar du på häcken? frågade han misstänksamt.,Varför stirra du på häcken? frågade han misstänksamt.
"Han lugnade sig hastigt och tog mig med ett stort, vitblänkande busflin och en blick på sina skyddslingar till medsvuren i sitt upphöjda värv.","Han lugna sig hastigt och tog mig med ett stort, vitblänkande busflin och en blick på sina skyddslingar till medsvuren i sitt upphöjda värv."
Hustrun ägnade sig åt barnen och åt sysslor som kunde ske på boplatsen eller nära denna.,Hustrun ägna sig åt barnen och åt sysslor som kunde ske på boplatsen eller nära denna.
Percy mumlade något vagt om att han behövde en ny gåspenna.,Percy mumla något vagt om att han behövde en ny gåspenna.
För Asea brukar kostnaden bli omkring 150000 kr i kvartalet.,För Asea bruka kostnaden bli omkring 150000 kr i kvartalet.
Kermit Roosevelt från CIA träffade ett antal officerare som varit inblandade i den sammansvärjning vilken ledde till statskuppen den 22 juli 1952.,Kermit Roosevelt från CIA träffa ett antal officerare som varit inblandade i den sammansvärjning vilken ledde till statskuppen den 22 juli 1952.
I uppställningen på sid. 27 kan du se vilka märken som finns på marknaden och deras cirkapriser som uppgivits för Spk i maj 1970.,I uppställningen på sid. 27 kunna du se vilka märken som finns på marknaden och deras cirkapriser som uppgivits för Spk i maj 1970.
"och så var det morgon, och Festus biträde stod i dörren med morgonteet.","och så vara det morgon, och Festus biträde stod i dörren med morgonteet."
"När det gäller misstag i fråga om laglighet och korrekthet, så ökar de också.","När det gälla misstag i fråga om laglighet och korrekthet, så ökar de också."
Han började från början och fortsatte steg för steg genom hela historien.,Han börja från början och fortsatte steg för steg genom hela historien.
"Harrys föräldrar hade dött i angreppet från Voldemort, men Harry hade undkommit med sitt blixtärr, och på något vis – ingen förstod varför – hade Voldemorts kraft brutits och tillintetgjorts i det ögonblick då han misslyckades med att döda Harry.","Harrys föräldrar ha dött i angreppet från Voldemort, men Harry hade undkommit med sitt blixtärr, och på något vis – ingen förstod varför – hade Voldemorts kraft brutits och tillintetgjorts i det ögonblick då han misslyckades med att döda Harry."
Så gör man likadant med valsedlarna för kommun- och landstingsvalen.,Så göra man likadant med valsedlarna för kommun- och landstingsvalen.
Industrin får möjlighet att utan tullhinder konkurrera på EEC-marknaden.,Industrin få möjlighet att utan tullhinder konkurrera på EEC-marknaden.
"Att utvinna olja, naturgas och speciellt vattenkraft fordrar höga begynnelseinvesteringar (t ex prospekteringar, borrningar och dammbyggen), men när väl produktionen är i gång, blir kostnaderna väsentligt lägre än vid den arbetskrävande kolbrytningen.","Att utvinna olja, naturgas och speciellt vattenkraft fordra höga begynnelseinvesteringar (t ex prospekteringar, borrningar och dammbyggen), men när väl produktionen är i gång, blir kostnaderna väsentligt lägre än vid den arbetskrävande kolbrytningen."
"När ackorden sätts, sätts dom så att man inte kan höja lönen ett dugg, fast enligt lagen ska det finnas en tioprocentig möjlighet att höja ackordet.","När ackorden sätts, sätts dom så att man inte kunna höja lönen ett dugg, fast enligt lagen ska det finnas en tioprocentig möjlighet att höja ackordet."
I brist på andra idéer slöt han ögonen.,I brist på andra idéer sluta han ögonen.
"är ett startmärke och är ett slutmärke som tillsammans beskriver ett dataelement, i det här fallet kundens namn.","vara ett startmärke och är ett slutmärke som tillsammans beskriver ett dataelement, i det här fallet kundens namn."
"Utan den stora vinningen med ett fullständigt datamaskinval är att valresultatet för riksdagsvalet kommer att vara till 99,9 procent färdigräknat innan valdagen är slut.","Utan den stora vinningen med ett fullständigt datamaskinval vara att valresultatet för riksdagsvalet kommer att vara till 99,9 procent färdigräknat innan valdagen är slut."
"Även underhållsbidrag, bidragsförskott, studiemedel, trafiklivräntor, yrkesskadelivräntor och vissa privata pensionsavtal är värdeskyddade genom anknytning till KPI.","Även underhållsbidrag, bidragsförskott, studiemedel, trafiklivräntor, yrkesskadelivräntor och vissa privata pensionsavtal vara värdeskyddade genom anknytning till KPI."
"I en fågelkoloni stimulerar paren varandra till häckning, och frekvensen av denna visar en nedgång om populationens storlek sjunker.","I en fågelkoloni stimulera paren varandra till häckning, och frekvensen av denna visar en nedgång om populationens storlek sjunker."
"Att vara barnsköterska till yrket är däremot en omtyckt och eftertraktad syssla, med högt anseende bland kibbutzmedlemmarna.","Att vara barnsköterska till yrket vara däremot en omtyckt och eftertraktad syssla, med högt anseende bland kibbutzmedlemmarna."
Nu har du gjort ditt.,Nu ha du gjort ditt.
Vid varje kärnklyvning får ej frigöras fler än en neutron.,Vid varje kärnklyvning få ej frigöras fler än en neutron.
"Där var han, byggd som King-Kong, ärelysten som Empire State Building, storögd som Fay Wray och lika mycket en dröm, ett fantasifoster, som filmerna och som Amerika i sig självt.","Där vara han, byggd som King-Kong, ärelysten som Empire State Building, storögd som Fay Wray och lika mycket en dröm, ett fantasifoster, som filmerna och som Amerika i sig självt."
"Nattetid, eller för att vara sanningsenlig, tre nätter i veckan stod han vid rodret på en bogserbåt.","Nattetid, eller för att vara sanningsenlig, tre nätter i veckan stå han vid rodret på en bogserbåt."
Kommittens betydelse har ökat mer och mer.,Kommittens betydelse ha ökat mer och mer.
"William Clough, guvernören, lyfte sina borstiga ögonbryn till överdriven hälsning på Mwetas bankett, alldeles som han brukade göra på tennisplanen i Dar-es-Salaam.","William Clough, guvernören, lyfta sina borstiga ögonbryn till överdriven hälsning på Mwetas bankett, alldeles som han brukade göra på tennisplanen i Dar-es-Salaam."
Jag frågade mig vad jag hade där att göra nu när min båt var borta.,Jag fråga mig vad jag hade där att göra nu när min båt var borta.
Innan de skildes åt dagen därpå sade han till Adamson Mweta: Olivia kan tyvärr inte komma med till självständighetsdagen... vår äldsta dotter väntar sin nedkomst just vid den tiden.,Innan de skiljas åt dagen därpå sade han till Adamson Mweta: Olivia kan tyvärr inte komma med till självständighetsdagen... vår äldsta dotter väntar sin nedkomst just vid den tiden.
"Om Storbritannien, Irland, Danmark och Norge som sökt medlemskap i EEC kommer med måste det bli andra röstningsregler.","Om Storbritannien, Irland, Danmark och Norge som sökt medlemskap i EEC komma med måste det bli andra röstningsregler."
Här i landet låter vi oftast våra barn vänta till 6 eller rent av till 7 års ålder innan de får dessa erfarenheter.,Här i landet låta vi oftast våra barn vänta till 6 eller rent av till 7 års ålder innan de får dessa erfarenheter.
Detta är några av alla de data som med lic Åke Nilsson vid psykiatriska kliniken i Lund fått fram i en undersökning av 165 gravida kvinnor.,Detta vara några av alla de data som med lic Åke Nilsson vid psykiatriska kliniken i Lund fått fram i en undersökning av 165 gravida kvinnor.
I undantagsfall kan dock hustrutillägg beviljas även om hustrun inte fyllt 60 år eller makarna varit gifta kortare tid än 5 år.,I undantagsfall kunna dock hustrutillägg beviljas även om hustrun inte fyllt 60 år eller makarna varit gifta kortare tid än 5 år.
Kvinnan har sålunda långt att gå innan hon vinner det politiska inflytande hennes ställning i samhällsarbetet och vid rösturnorna motiverar.,Kvinnan ha sålunda långt att gå innan hon vinner det politiska inflytande hennes ställning i samhällsarbetet och vid rösturnorna motiverar.
En gymnasist får inte tillräckligt höga betyg och slutar för att senare gå i vuxengymnasium och konkurrera med mindre studievana kamrater.,En gymnasist få inte tillräckligt höga betyg och slutar för att senare gå i vuxengymnasium och konkurrera med mindre studievana kamrater.
Skilsmässa eller inte - vad säger de som inte är religiösa?,Skilsmässa eller inte - vad säga de som inte är religiösa?
Vänner som inte ens skriver till Harry Potter? sade Dobby knipslugt.,Vänner som inte ens skriva till Harry Potter? sade Dobby knipslugt.
"När han for hem på semester rumlade han om i stor skala, skrytsamt, med mentaliteten hos en sjöman i hamn och bara i yttre måtto på ett annat plan.","När han fara hem på semester rumlade han om i stor skala, skrytsamt, med mentaliteten hos en sjöman i hamn och bara i yttre måtto på ett annat plan."
Det begriper jag inte alls.,Det begripa jag inte alls.
"Namnet Malfoy inger fortfarande en viss respekt, men Ministeriet lägger sig i mer och mer hela tiden.","Namnet Malfoy inge fortfarande en viss respekt, men Ministeriet lägger sig i mer och mer hela tiden."
Det hade kommit ett brådskande telefonsamtal till honom.,Det ha kommit ett brådskande telefonsamtal till honom.
Han hade aldrig varit i ett trollkarlshem förut.,Han ha aldrig varit i ett trollkarlshem förut.
En nyhet är att det obligatoriska uppehållet kl 11.00 - 13.00 är slopat.,En nyhet vara att det obligatoriska uppehållet kl 11.00 - 13.00 är slopat.
Men nu måste folk lära sig att det finns ett hälsovårdsdepartement som man kan vända sig till.,Men nu måste folk lära sig att det finnas ett hälsovårdsdepartement som man kan vända sig till.
Den gamle mannen hade blivit en del av staden.,Den gamle mannen ha blivit en del av staden.
Och deras situation är allaredan besvärlig.,Och deras situation vara allaredan besvärlig.
Men det förutsätter att också den andra parten står utanför.,Men det förutsätta att också den andra parten står utanför.
Upprepade fall av barnmisshandel visar att vår lagstiftning inte kunnat ge garantier mot vanvård och övergrepp.,Upprepade fall av barnmisshandel visa att vår lagstiftning inte kunnat ge garantier mot vanvård och övergrepp.
Jag avbröt honom med att jag hade hört talas om mr Kurtz vid kusten.,Jag avbryta honom med att jag hade hört talas om mr Kurtz vid kusten.
Det fanns sedan gammalt två traditioner: de kungliga slotts- och jaktparkerna å ena sidan och allmänningarna å den andra.,Det finnas sedan gammalt två traditioner: de kungliga slotts- och jaktparkerna å ena sidan och allmänningarna å den andra.
När du exporterar en tabell till ett XML-dokument kan du också exportera de relaterade tabellerna.,När du exportera en tabell till ett XML-dokument kan du också exportera de relaterade tabellerna.
Förlåt mig. Givetvis har jag det. Quinn.,Förlåt mig. Givetvis ha jag det. Quinn.
"Det är en inkomst som skapar standarden för välståndssamhällets alla grupper, också för dem som aldrig fostrat upp några barn.","Det vara en inkomst som skapar standarden för välståndssamhällets alla grupper, också för dem som aldrig fostrat upp några barn."
Invandrarna från de nordiska länderna utgör ungefär 2/3 av alla invandrare i Sverige.,Invandrarna från de nordiska länderna utgöra ungefär 2/3 av alla invandrare i Sverige.
"Tyvärr visar det, med all respekt, en enorm okunnighet om vad som verkligen sker med vinet i de länder dit de skeppas.","Tyvärr visa det, med all respekt, en enorm okunnighet om vad som verkligen sker med vinet i de länder dit de skeppas."
"Försiktig beräkning visar att en besparing på 75000 kronor, ungefär 300 vårddagar hade kunnat sparas redan under gammakamerans första användningsår.","Försiktig beräkning visa att en besparing på 75000 kronor, ungefär 300 vårddagar hade kunnat sparas redan under gammakamerans första användningsår."
Det finns idag många variationer på icke religiösa äktenskapsuppfattningar.,Det finnas idag många variationer på icke religiösa äktenskapsuppfattningar.
Fred snurrade på ratten.,Fred snurra på ratten.
Redan om 30 år är läget bokstavligt olidligt.,Redan om 30 år vara läget bokstavligt olidligt.
"Jaså, ska du börja på Hogwarts i år? frågade Harry Ginny.","Jaså, skola du börja på Hogwarts i år? frågade Harry Ginny."
2 En korsfråga som bygger på urvalsfrågan,2 En korsfråga som bygga på urvalsfrågan
Den nivån inger mig inga bekymmer.,Den nivån inge mig inga bekymmer.
Jag vill bara helt kort beröra den externa ekonomiska aspekten.,Jag vilja bara helt kort beröra den externa ekonomiska aspekten.
"En sån här sak gör den inte bättre, säger ombudsman Gösta Lindebo i Svenska ostkustfiskarnas centralförbund.","En sån här sak göra den inte bättre, säger ombudsman Gösta Lindebo i Svenska ostkustfiskarnas centralförbund."
"Shahar för mig ner från Mishkenot Shaananim, som ligger på en sluttning och vetter mot Mount Zion och Gamla staden, till Gai-Hinnom (traditionens Gehenna) där Moloksdyrkarna en gång offrade sina barn.","Shahar föra mig ner från Mishkenot Shaananim, som ligger på en sluttning och vetter mot Mount Zion och Gamla staden, till Gai-Hinnom (traditionens Gehenna) där Moloksdyrkarna en gång offrade sina barn."
"uttryckt i det dånande jubel som med jämna mellanrum ekade ut från folkmassan, togorna, de medaljbehängda brösten, de vita handskarna, kvinnornas gälla, utdragna skrin, soldaterna i enskild ställning och solen som blänkte i orkestrarnas skrällande mässingsinstrument.","uttryckt i det dånande jubel som med jämna mellanrum eka ut från folkmassan, togorna, de medaljbehängda brösten, de vita handskarna, kvinnornas gälla, utdragna skrin, soldaterna i enskild ställning och solen som blänkte i orkestrarnas skrällande mässingsinstrument."
Sedan slängde han på luren och slängde upp sin sekreterare i luften.,Sedan slänga han på luren och slängde upp sin sekreterare i luften.
Jag tror att kommissionen i många fall har gjort ett mycket bra arbete.,Jag tro att kommissionen i många fall har gjort ett mycket bra arbete.
"Du kan också tillhandahålla schemat till andra företag och avdelningar så att de vet hur data som skickas till dig ska struktureras, och de kan i sin tur ge dig sitt schema.","Du kunna också tillhandahålla schemat till andra företag och avdelningar så att de vet hur data som skickas till dig ska struktureras, och de kan i sin tur ge dig sitt schema."
Det var därför jag tryckte på insläppningsknappen utan att fråga vem det var.,Det vara därför jag tryckte på insläppningsknappen utan att fråga vem det var.
"Pappa, det är en person som kommer hem trött på kvällen från detta som kallas arbete och som ger pengar - observera motsatsen till vad mamma gör och som inte ger pengar - till kola, leksaker, pappas bil, mat och hyra.","Pappa, det vara en person som kommer hem trött på kvällen från detta som kallas arbete och som ger pengar - observera motsatsen till vad mamma gör och som inte ger pengar - till kola, leksaker, pappas bil, mat och hyra."
Om hur Access söker efter referensbibliotek,Om hur Access söka efter referensbibliotek
Hur mycket skall du betala?,Hur mycket skola du betala?
Den moderna barnpsykologin har klarlagt hur betydelsefull emotionell kontakt är för ett barns harmoniska utveckling - ett behov som det huvudsakligen tillkommit mödrarna att tillfredsställa.,Den moderna barnpsykologin ha klarlagt hur betydelsefull emotionell kontakt är för ett barns harmoniska utveckling - ett behov som det huvudsakligen tillkommit mödrarna att tillfredsställa.
De här citaten representerar två diametralt motsatta ståndpunkter när det gäller synen på äktenskapet och familjen.,De här citaten representera två diametralt motsatta ståndpunkter när det gäller synen på äktenskapet och familjen.
Alla förstår därför att jag inte kan godta dem.,Alla förstå därför att jag inte kan godta dem.
Det nya grundavdraget - som ersätter tidigare ortsavdrag - uppgår till 4500 kr för varje skattskyldig med en till statlig inkomstskatt taxerad inkomst av högst 30000 kr.,Det nya grundavdraget - som ersätta tidigare ortsavdrag - uppgår till 4500 kr för varje skattskyldig med en till statlig inkomstskatt taxerad inkomst av högst 30000 kr.
Makar som vill gå skilda vägar möter en friare lagstiftning och en tolerantare opinion.,Makar som vilja gå skilda vägar möter en friare lagstiftning och en tolerantare opinion.
Ikväll hade han ingen lust att gå på någon bar – att äta i halvdunklet omgiven av berusat pladder – trots att han normalt inte hade någonting emot det.,Ikväll ha han ingen lust att gå på någon bar – att äta i halvdunklet omgiven av berusat pladder – trots att han normalt inte hade någonting emot det.
"Han räckte mig tidningarna, så att jag kunde leta fram Rose Kennedys ord.","Han räcka mig tidningarna, så att jag kunde leta fram Rose Kennedys ord."
Men jag ser att hans lidandes starka ström är kraftigt påkopplad.,Men jag se att hans lidandes starka ström är kraftigt påkopplad.
Hör av er så snart ni kan så jag får veta vad som händer. Hjärtliga hälsningar från Hermione.,Hör av er så snart ni kunna så jag får veta vad som händer. Hjärtliga hälsningar från Hermione.
Femkronorssedeln finns kvar.,Femkronorssedeln finnas kvar.
De nya bestämmelserna gäller inte för pensionärer som vårdats på sjukhus hela år 1969.,De nya bestämmelserna gälla inte för pensionärer som vårdats på sjukhus hela år 1969.
Marlow satt längst akterut med benen i kors och ryggen mot mesanmasten.,Marlow sitta längst akterut med benen i kors och ryggen mot mesanmasten.
När man söker jobb vill man ha så stora valmöjligheter som möjligt.,När man söka jobb vill man ha så stora valmöjligheter som möjligt.
"Vilket annat syfte med äktenskapets stiftelse som härutöver än kan anges, blir hur som helst ett andrahandssyfte.","Vilket annat syfte med äktenskapets stiftelse som härutöver än kunna anges, blir hur som helst ett andrahandssyfte."
"I många fall utlöste det ett skratt, godmodigt eller harmset:","I många fall utlösa det ett skratt, godmodigt eller harmset:"
"Men inflationen har också här rusat fram och priserna har gått upp, dock inte så mycket som i Sverige.","Men inflationen ha också här rusat fram och priserna har gått upp, dock inte så mycket som i Sverige."
"Vi ska se till, att framtid och innovation blir drivkrafterna för detta program.","Vi skola se till, att framtid och innovation blir drivkrafterna för detta program."
Jag insåg inte genast vad det där skeppsbrottet verkligen innebar.,Jag inse inte genast vad det där skeppsbrottet verkligen innebar.
Belysningen var skum därinne; i mitten stod ett massivt skrivbord.,Belysningen vara skum därinne; i mitten stod ett massivt skrivbord.
"Denna bör ofta vara stor, eftersom människor utbildar vanor och därmed behov.","Denna böra ofta vara stor, eftersom människor utbildar vanor och därmed behov."
Hon nickade och rodnade ända ner till rötterna på sitt flammande hår medan hon lade armbågen i smöret.,Hon nicka och rodnade ända ner till rötterna på sitt flammande hår medan hon lade armbågen i smöret.
"Industriländerna (USA, Sovjet, Sverige etc) använder en mycket större del av sin nationalprodukt på utbildning (fem procent) än u-länderna (tre procent).","Industriländerna (USA, Sovjet, Sverige etc) använda en mycket större del av sin nationalprodukt på utbildning (fem procent) än u-länderna (tre procent)."
Utländska medborgare skall behandlas likvärdigt med svenska medborgare - detta är den vägledande regeln.,Utländska medborgare skola behandlas likvärdigt med svenska medborgare - detta är den vägledande regeln.
Och ju längre tid som förflutit mellan avgång och återinträde i förvärvslivet ju större blir svårigheterna.,Och ju längre tid som förflutit mellan avgång och återinträde i förvärvslivet ju större bli svårigheterna.
Det var ett beklagligt faktum att jag var frånvarande just den fredagen.,Det vara ett beklagligt faktum att jag var frånvarande just den fredagen.
Orsakerna är komplexa.,Orsakerna vara komplexa.
För den svagare har ofta vetskapen om att leva i nära gemenskap med en annan utgjort en ovärderlig tillgång.,För den svagare ha ofta vetskapen om att leva i nära gemenskap med en annan utgjort en ovärderlig tillgång.
"Det var vad vi hade i torsdags. Och i går... Bara etthundranio, det var allt...","Det vara vad vi hade i torsdags. Och i går... Bara etthundranio, det var allt..."
De samhällsbildande insekterna ger goda exempel på detta.,De samhällsbildande insekterna ge goda exempel på detta.
"Det blev en lång, chockad tystnad när han hade slutat.","Det bli en lång, chockad tystnad när han hade slutat."
"Den får han alltid, vare sig han vill det eller inte.","Den få han alltid, vare sig han vill det eller inte."
Ett vilt babblande av barbariska läten brast lös på andra sidan väggen.,Ett vilt babblande av barbariska läten brista lös på andra sidan väggen.
Innan vi hinner blinka får vi kanske en förste ordningsman till i familjen.,Innan vi hinna blinka får vi kanske en förste ordningsman till i familjen.
"Inte förrän många månader senare, när jag försökte få reda på vad som fanns kvar av hans kropp, fick jag veta att bråket ursprungligen uppstod ur ett missförstånd angående ett par höns.","Inte förrän många månader senare, när jag försöka få reda på vad som fanns kvar av hans kropp, fick jag veta att bråket ursprungligen uppstod ur ett missförstånd angående ett par höns."
Nödvändigheten av utvecklingssamarbete har framstått allt klarare.,Nödvändigheten av utvecklingssamarbete ha framstått allt klarare.
En av nyheterna i årets val är att rösträttsåldern sänkts med ett år.,En av nyheterna i årets val vara att rösträttsåldern sänkts med ett år.
Han hade kommit att tycka att det inte var alldeles obehagligt att vara Paul Auster.,Han ha kommit att tycka att det inte var alldeles obehagligt att vara Paul Auster.
"De som ska handleda barn är en av samhällets viktigaste yrkesgrupper och vi måste rekrytera, utbilda och betala dem därefter.","De som skola handleda barn är en av samhällets viktigaste yrkesgrupper och vi måste rekrytera, utbilda och betala dem därefter."
Framtiden är snabbkontroll av hörseln och registrering av defekter och uppfattningsförmåga via data.,Framtiden vara snabbkontroll av hörseln och registrering av defekter och uppfattningsförmåga via data.
Min teori är att Don Quijote utförde ett experiment.,Min teori vara att Don Quijote utförde ett experiment.
Som bekant kan lagöverträdare under 15 år inte drabbas av någon straffpåföljd.,Som bekant kunna lagöverträdare under 15 år inte drabbas av någon straffpåföljd.
Flickan får därigenom en mer positiv inställning till och större förståelse för det motsatta könet och pojken får en bra manlig identifiering.,Flickan få därigenom en mer positiv inställning till och större förståelse för det motsatta könet och pojken får en bra manlig identifiering.
"Fågeln hade gett sig iväg; han visste det, nästan som om klornas fjäderlätta tyngd hade tryckt ner taket och trycket nu hade lättat.","Fågeln ha gett sig iväg; han visste det, nästan som om klornas fjäderlätta tyngd hade tryckt ner taket och trycket nu hade lättat."
Detta är en rättighet som inte medför ekonomiska konsekvenser.,Detta vara en rättighet som inte medför ekonomiska konsekvenser.
Den unge mannen hade alldeles nyss befordrats till ansvarig för atlantfarten.,Den unge mannen ha alldeles nyss befordrats till ansvarig för atlantfarten.
"Ingenting stöder tesen, att den rigorösa attityden skulle skapa bättre förutsättningar för ett lyckligt äktenskap.","Ingenting stödja tesen, att den rigorösa attityden skulle skapa bättre förutsättningar för ett lyckligt äktenskap."
Försvaret har inte haft råd att inköpa materielen.,Försvaret ha inte haft råd att inköpa materielen.
Han såg det som talade för att ringa och samtidigt såg han också det som talade emot att göra det.,Han se det som talade för att ringa och samtidigt såg han också det som talade emot att göra det.
20-30 personer delar på en kallvattenskran.,20-30 personer del på en kallvattenskran.
Ibland hamnar ledningarna i kors och en person kan komma fel även om han slår rätt nummer.,Ibland hamna ledningarna i kors och en person kan komma fel även om han slår rätt nummer.
Det enda verkliga i alltsammans var allas strävan att bli placerade på en handelsstation där det kom in elfenben så att de kunde få procent.,Det enda verkliga i alltsammans vara allas strävan att bli placerade på en handelsstation där det kom in elfenben så att de kunde få procent.
"Den här är inte särskilt bekväm för en reslig man som ni, överste.","Den här vara inte särskilt bekväm för en reslig man som ni, överste."
