grammatical,ungrammatical
Vi ser att fadern har högre auktoritet än modern.,Vi se att fadern har högre auktoritet än modern.
Även vuxna borde i större utsträckning använda flytväst.,Även vuxna böra i större utsträckning använda flytväst.
"Avlöning, säger någon, visst får jag avlöning, min man lägger alla pengarna på bordet då han kommer hem på avlöningsdagen.","Avlöning, säga någon, visst får jag avlöning, min man lägger alla pengarna på bordet då han kommer hem på avlöningsdagen."
"Han bevistade flertalet officiella evenemang (han och Roly hälsade med spelad överraskning på varandra när de träffades i huset, halvklädda i smoking eller frack varenda kväll), men de verkliga tillställningarna försiggick före eller efter.","Han bevista flertalet officiella evenemang (han och Roly hälsade med spelad överraskning på varandra när de träffades i huset, halvklädda i smoking eller frack varenda kväll), men de verkliga tillställningarna försiggick före eller efter."
Jag sa mitt namn och tittade mig omkring.,Jag säga mitt namn och tittade mig omkring.
Den ena dimensionen är auktoritet eller makt; se figuren nedan.,Den ena dimensionen vara auktoritet eller makt; se figuren nedan.
Hon var beredd att röra upp himmel och jord för att få mig utnämnd till kapten på en flodångare om det var det jag ville.,Hon vara beredd att röra upp himmel och jord för att få mig utnämnd till kapten på en flodångare om det var det jag ville.
Här har givetvis den sexuella lusten sin uppgift - vid sidan av fortplantningen.,Här ha givetvis den sexuella lusten sin uppgift - vid sidan av fortplantningen.
Harry tyckte han hörde hur rösterna där nere började sväva på målet.,Harry tycka han hörde hur rösterna där nere började sväva på målet.
"Mot detta invänds, att även om gruppäktenskap skulle lösa vissa problem, skulle andra problem skapas, då inte längre en man och en kvinna kunde göra anspråk på att få rå om varandra.","Mot detta invänds, att även om gruppäktenskap skola lösa vissa problem, skulle andra problem skapas, då inte längre en man och en kvinna kunde göra anspråk på att få rå om varandra."
Ras Asahe menade de vita –,Ras Asahe mena de vita –
Statens oförmåga att bygga bort bostadsköerna har starkt kritiserats.,Statens oförmåga att bygga bort bostadsköerna ha starkt kritiserats.
De tre senare har såväl teoretiska som praktiska inslag.,De tre senare ha såväl teoretiska som praktiska inslag.
Färre barn skaffar man sig först då man ser en utväg ur sin fattigdom.,Färre barn skaffa man sig först då man ser en utväg ur sin fattigdom.
Han hoppades att det inte var sant.,Han hoppas att det inte var sant.
"Ställa in ljuset, kontrollera bromsarna, ladda batteriet och se till att det har effekt kvar för att klara bister vinterkyla.","Ställa in ljuset, kontrollera bromsarna, ladda batteriet och se till att det ha effekt kvar för att klara bister vinterkyla."
"Man började för fem år sedan, när antirökningskampanjen drogs i gång, med en upplysningskampanj på mycket bred basis.","Man börja för fem år sedan, när antirökningskampanjen drogs i gång, med en upplysningskampanj på mycket bred basis."
Jag förutser ett problem och ber flygvärdinnan servera mig en koscherlunch.,Jag förutse ett problem och ber flygvärdinnan servera mig en koscherlunch.
Engelsmän är inte artiga hur mycket man än betalar dem.,Engelsmän vara inte artiga hur mycket man än betalar dem.
Han höll sig på sin kant mot de andra agenterna och de betalade igen med att säga att han spionerade på dem för direktörens räkning.,Han hålla sig på sin kant mot de andra agenterna och de betalade igen med att säga att han spionerade på dem för direktörens räkning.
Är er fru judisk?,vara er fru judisk?
Den kristna äktenskapsetiken framstår säkert för många människor idag som djupt konservativ och olustig.,Den kristna äktenskapsetiken framstå säkert för många människor idag som djupt konservativ och olustig.
"I I-länderna de industrialiserade länderna, bor något över 1 miljard människor, 30 procent av jordens befolkning.","I I-länderna de industrialiserade länderna, bo något över 1 miljard människor, 30 procent av jordens befolkning."
Han lyssnade en kort stund.,Han lyssna en kort stund.
Holland och övriga länder exploaterar naturen hos ursprungsbefolkningar för foderproduktion till höns och svin.,Holland och övriga länder exploatera naturen hos ursprungsbefolkningar för foderproduktion till höns och svin.
"Jag hittar faktiskt inte på det här, sa Quinn. Jag har till och med bevis.","Jag hitta faktiskt inte på det här, sa Quinn. Jag har till och med bevis."
Men den kanske är på väg.,Men den kanske vara på väg.
Ändå talar utvecklingsoptimisterna i USA om att tre- eller fyrdubbla den nuvarande konsumtionsstandarden och även utvidga den till u-länderna.,Ändå tala utvecklingsoptimisterna i USA om att tre- eller fyrdubbla den nuvarande konsumtionsstandarden och även utvidga den till u-länderna.
Den har skötselanvisningar.,Den ha skötselanvisningar.
Först när kvinnorna deltar i produktionen tillsammans med männen kan de bli helt emanciperade; rollen som husmor innebär alltid en beroendeställning.,Först när kvinnorna delta i produktionen tillsammans med männen kan de bli helt emanciperade; rollen som husmor innebär alltid en beroendeställning.
Hon slängde in mig i baksätet och kastade sig själv efter i en virvelvind av Dior och hårnålar.,Hon slänga in mig i baksätet och kastade sig själv efter i en virvelvind av Dior och hårnålar.
"Nu är du verkligen sent ute, om du inte gjort i ordning bilen för vintern.","Nu vara du verkligen sent ute, om du inte gjort i ordning bilen för vintern."
Och det gör de fortfarande efter cirka fyratusen år.,Och det göra de fortfarande efter cirka fyratusen år.
"Cloughs hade flyttat in på brittiska konsulatet över den sista veckan eller så innan de gav sig i väg, en stor, glasblänkande, modern byggnad, inplacerad i terrängen så att de parasollformade törnträden skulle komma till sin rätt, alldeles som på en arkitektmodell.","Cloughs ha flyttat in på brittiska konsulatet över den sista veckan eller så innan de gav sig i väg, en stor, glasblänkande, modern byggnad, inplacerad i terrängen så att de parasollformade törnträden skulle komma till sin rätt, alldeles som på en arkitektmodell."
Som det nu är ser det inte vidare trevligt ut med toalettpapper och avföringshögar vid stränderna till de populära ankringsvikarna i skärgårdarna.,Som det nu vara ser det inte vidare trevligt ut med toalettpapper och avföringshögar vid stränderna till de populära ankringsvikarna i skärgårdarna.
Antalet andelar i lotteriet minskar också.,Antalet andelar i lotteriet minska också.
"I det oavlåtliga flugsurret låg den hemskickade agenten rödflammig och medvetslös; den andre satt böjd över sina böcker och förde in korrekta transaktioner i korrekta poster, och femton meter nedanför mig såg jag dödsdungens orörliga trädtoppar.","I det oavlåtliga flugsurret ligga den hemskickade agenten rödflammig och medvetslös; den andre satt böjd över sina böcker och förde in korrekta transaktioner i korrekta poster, och femton meter nedanför mig såg jag dödsdungens orörliga trädtoppar."
"Det var rörelsen som var det viktiga, detta att sätta den ena foten framför den andra och liksom låta sig hänga på släp efter den egna kroppen.","Det vara rörelsen som var det viktiga, detta att sätta den ena foten framför den andra och liksom låta sig hänga på släp efter den egna kroppen."
"Och mördaren, som talar till ett av artonhundratalets stora genier, svarar: Därför att ni är så enfaldig att man inte kan låta bli att tycka synd om er.","Och mördaren, som tala till ett av artonhundratalets stora genier, svarar: Därför att ni är så enfaldig att man inte kan låta bli att tycka synd om er."
I detta fall talade vi om marknaden för förädlade köttprodukter.,I detta fall tala vi om marknaden för förädlade köttprodukter.
Kommunalt grundavdrag kan avräknas även från inkomst i annan kommun än hemortskommunen.,Kommunalt grundavdrag kunna avräknas även från inkomst i annan kommun än hemortskommunen.
"Akta er för att tappa humöret, det är farligare än att gå i solen.","Akta er för att tappa humöret, det vara farligare än att gå i solen."
"Till exempel smör, bröd, kött, mjölk måste fortfarande kunna ha styckepriser som inte slutar med fem eller noll öre.","Till exempel smör, bröd, kött, mjölk måste fortfarande kunna ha styckepriser som inte sluta med fem eller noll öre."
Den elementära undervisningen skall vara obligatorisk.,Den elementära undervisningen skola vara obligatorisk.
"(Tatu, som har bott i Moskva i flera år, småpratar på ryska med Stern och Schneider.)","(Tatu, som ha bott i Moskva i flera år, småpratar på ryska med Stern och Schneider.)"
"Han kände sig förunderligt rofylld, som om allting redan hade hänt honom.","Han känna sig förunderligt rofylld, som om allting redan hade hänt honom."
"Så angelägna och allvarliga är frågorna om skolk och elevvård i år att rektorer, skolsköterskor, skolpsykologer och många andra ringde kuratorerna Anna-Britta Hellgren och Ulla Hasselquist och bad att få vara med.","Så angelägna och allvarliga vara frågorna om skolk och elevvård i år att rektorer, skolsköterskor, skolpsykologer och många andra ringde kuratorerna Anna-Britta Hellgren och Ulla Hasselquist och bad att få vara med."
"Jag tittar, jag ser runda flaskan är rött vin inuti...","Jag titta, jag ser runda flaskan är rött vin inuti..."
Kör aldrig med sprit i kroppen - även en enda mellanöl ger påverkan.,Kör aldrig med sprit i kroppen - även en enda mellanöl ge påverkan.
Du kan ange start- och slutvärden för grupperingsintervallet.,Du kunna ange start- och slutvärden för grupperingsintervallet.
Jag säger det här av egen fri vilja. Ja.,Jag säga det här av egen fri vilja. Ja.
"För Israel, som ger oss ett opartiskt mottagande, är egendomliga gäster ingenting ovanligt.","För Israel, som ge oss ett opartiskt mottagande, är egendomliga gäster ingenting ovanligt."
I oljeländer som Saudi-Arabien lever en del i ofattbart överflöd.,I oljeländer som Saudi-Arabien leva en del i ofattbart överflöd.
"Nej, men det är en annan historia, sade Wentz.","Nej, men det vara en annan historia, sade Wentz."
Psykologerna utarbetar allt fler förfinade test för att få rätt man placerad på rätt plats i produktionen.,Psykologerna utarbeta allt fler förfinade test för att få rätt man placerad på rätt plats i produktionen.
Harpun ohoj! sa min far.,Harpun ohoj! säga min far.
Alla bärarna talade i munnen på varandra och mitt i oväsendet hördes bokhållarens klagande röst ge upp för tjugonde gången den dagen...,Alla bärarna tala i munnen på varandra och mitt i oväsendet hördes bokhållarens klagande röst ge upp för tjugonde gången den dagen...
"Jo då, allt var helt i sin ordning.","Jo då, allt vara helt i sin ordning."
Det bästa som finns är dagar då pusslet får sin egen innebörd och jag inte längre bryr mig om vilken bild som träder fram.,Det bästa som finnas är dagar då pusslet får sin egen innebörd och jag inte längre bryr mig om vilken bild som träder fram.
Under våren sker parbildning varvid det är honan som tar initiativet.,Under våren ske parbildning varvid det är honan som tar initiativet.
"Den ger vägledning på ungefär samma sätt som kostcirkeln, som hjälper oss att välja rätt kost för att få riktig näring.","Den ge vägledning på ungefär samma sätt som kostcirkeln, som hjälper oss att välja rätt kost för att få riktig näring."
En vanlig karakteristik av ett u-land är att bruttonationalprodukten (BNP) per person och år understiger en viss summa.,En vanlig karakteristik av ett u-land vara att bruttonationalprodukten (BNP) per person och år understiger en viss summa.
Att få ett barn är en stor upplevelse och glädje och medför en genomgripande förändring av vårt liv.,Att få ett barn vara en stor upplevelse och glädje och medför en genomgripande förändring av vårt liv.
"De här lösningarna går alla ut på att lösa frågan om tillsyn, knappast om fostran.","De här lösningarna gå alla ut på att lösa frågan om tillsyn, knappast om fostran."
Och när han kommer hem från jobbet gör han inte ett dugg hemma.,Och när han komma hem från jobbet gör han inte ett dugg hemma.
Diagrammet nedan åskådliggör också den fortgående förskjutningen inom energiproduktionen.,Diagrammet nedan åskådliggöra också den fortgående förskjutningen inom energiproduktionen.
Ögonen är gröna.,Ögonen vara gröna.
"1700- och 1800-talens industrialisering i England, Frankrike, Tyskland, Holland o s v förutsatte en ordnad försörjning med råvaror för industrin (bomull, jute, hampa, metaller, gummi).","1700- och 1800-talens industrialisering i England, Frankrike, Tyskland, Holland o s v förutsätta en ordnad försörjning med råvaror för industrin (bomull, jute, hampa, metaller, gummi)."
Om detta låter grymt är det endast den grymhet som kommer ur alltför ingående och alltför långvariga iakttagelser.,Om detta låta grymt är det endast den grymhet som kommer ur alltför ingående och alltför långvariga iakttagelser.
"En ålderstigen häxa stod framför honom. Hon bar på en bricka med någonting som var förfärande likt människonaglar, utdragna från roten.","En ålderstigen häxa stå framför honom. Hon bar på en bricka med någonting som var förfärande likt människonaglar, utdragna från roten."
Som lagen nu är formulerad står det kommunerna fritt att tolka denna paragraf.,Som lagen nu vara formulerad står det kommunerna fritt att tolka denna paragraf.
Av hävd har många vårdyrken kommit att betraktas som typiskt kvinnliga.,Av hävd ha många vårdyrken kommit att betraktas som typiskt kvinnliga.
Hans klocka visade på nästan sex.,Hans klocka visa på nästan sex.
Kan man komma tillrätta med bostadsköerna?,kunna man komma tillrätta med bostadsköerna?
Utan borrning kan man aldrig få besked.,Utan borrning kunna man aldrig få besked.
"Jag får pension efter min make, säger Du.","Jag få pension efter min make, säger Du."
Dagtid var min far en smart och ständigt allt smartare man.,Dagtid vara min far en smart och ständigt allt smartare man.
Han tackade honom – lyssnade till båda männen på en gång utan att höra någondera – och följde efter den muskulösa ändan i vita shorts förbi spärrar och genom ankomsthallen.,Han tacka honom – lyssnade till båda männen på en gång utan att höra någondera – och följde efter den muskulösa ändan i vita shorts förbi spärrar och genom ankomsthallen.
Hur gör jag?,Hur göra jag?
"Men samtidigt medför denna restriktiva miljö, att ett antal personer, som inte orkar motsvara de rigorösa rollförväntningarna, visar starkare tendens till sexuell promiskuitet än personer som lever i tolerantare miljö.","Men samtidigt medföra denna restriktiva miljö, att ett antal personer, som inte orkar motsvara de rigorösa rollförväntningarna, visar starkare tendens till sexuell promiskuitet än personer som lever i tolerantare miljö."
"Utopier har den nackdelen att de låter så utopiska, men - eftersom förhållandena nu inte är gynnsamma för någon kategori - borde vi inte i liten skala pröva också andra sätt att leva?","Utopier ha den nackdelen att de låter så utopiska, men - eftersom förhållandena nu inte är gynnsamma för någon kategori - borde vi inte i liten skala pröva också andra sätt att leva?"
"I designläget i ett formulär, en rapport eller på en dataåtkomstsida kan du formatera en kontroll på följande sätt:","I designläget i ett formulär, en rapport eller på en dataåtkomstsida kunna du formatera en kontroll på följande sätt:"
"Bray blev tvungen att resa på sig för att bli föreställd för en kraftig kvinna som stannat till utanför virveln av dansande i sällskap med amerikanen, Curtis Pettigrew: det var en västafrikanska som Timothy Odara hade gift sig med sedan Bray senast träffat honom.","Bray bli tvungen att resa på sig för att bli föreställd för en kraftig kvinna som stannat till utanför virveln av dansande i sällskap med amerikanen, Curtis Pettigrew: det var en västafrikanska som Timothy Odara hade gift sig med sedan Bray senast träffat honom."
"Olivia gick in för att byta skiva och eftersom den, helt oväntat, visade sig vara Mozart – konserten för harpa och flöjt – beslöt han sig för att röka en cigarr medan han avnjöt den.","Olivia gå in för att byta skiva och eftersom den, helt oväntat, visade sig vara Mozart – konserten för harpa och flöjt – beslöt han sig för att röka en cigarr medan han avnjöt den."
Sverige får ju möjlighet att driva fram sina ideer osv.,Sverige få ju möjlighet att driva fram sina ideer osv.
Och köparna betalar sällan med dem.,Och köparna betala sällan med dem.
På senare tid har också industriarbeten startats.,På senare tid ha också industriarbeten startats.
"Har du förslag på förbättringar i din trafikmiljö som skulle göra den enklare, överskådligare och därmed säkrare?","ha du förslag på förbättringar i din trafikmiljö som skulle göra den enklare, överskådligare och därmed säkrare?"
Hon hade nycklarna.,Hon ha nycklarna.
"De har samma skydd för sin person och egendom, samma möjligheter till utbildning, hälso- och sjukvård som svenskar.","De ha samma skydd för sin person och egendom, samma möjligheter till utbildning, hälso- och sjukvård som svenskar."
RFSU-laboratoriet informerar,RFSU-laboratoriet informera
När fartyget passerade Stromboli nattetid flöt det en strimma av karmosinröd lava från vulkanen men sjömännen ville inte gå ifrån TV-apparaten för att titta på detta naturfenomen.,När fartyget passera Stromboli nattetid flöt det en strimma av karmosinröd lava från vulkanen men sjömännen ville inte gå ifrån TV-apparaten för att titta på detta naturfenomen.
"Denna sammanslutning består av mycket framstående och välmeriterade ambassadörer, en från vart och ett av EEC-länderna.","Denna sammanslutning bestå av mycket framstående och välmeriterade ambassadörer, en från vart och ett av EEC-länderna."
Innan du tar ut din skatteåterbäring,Innan du ta ut din skatteåterbäring
"Inte för mig, sade mr Malfoy med vibrerande näsborrar.","Inte för mig, säga mr Malfoy med vibrerande näsborrar."
Spädbarnet behöver trygg omvårdnad och mycket ömhet för att trivas.,Spädbarnet behöva trygg omvårdnad och mycket ömhet för att trivas.
Paket med vanlig befordran transporteras med de postlägenheter som är avsedda för den tyngre och utrymmeskrävande posten.,Paket med vanlig befordran transporteras med de postlägenheter som vara avsedda för den tyngre och utrymmeskrävande posten.
"Om du flyttar linjen åt vänster, förblir avståndet mellan den flyttade linjen och den närmaste parallella linjen till höger konstant, och den vinkelräta linjen till vänster om den flyttade linjen förkortas.","Om du flytta linjen åt vänster, förblir avståndet mellan den flyttade linjen och den närmaste parallella linjen till höger konstant, och den vinkelräta linjen till vänster om den flyttade linjen förkortas."
"Förlorarna blir skattebetalaren, som måste betala det hela, småföretagen och den artsanpassade djurhållningen.","Förlorarna bli skattebetalaren, som måste betala det hela, småföretagen och den artsanpassade djurhållningen."
Du kommer att bo tillsammans med 10-20 kamrater.,Du komma att bo tillsammans med 10-20 kamrater.
Som till exempel när en gammal häxa dog förra året och hennes teservis såldes till en antikaffär.,Som till exempel när en gammal häxa dö förra året och hennes teservis såldes till en antikaffär.
Detta är emellertid ett område där vår kunskap om de nu existerande samhällsorganisationerna i djurvärlden är mycket ofullständig.,Detta vara emellertid ett område där vår kunskap om de nu existerande samhällsorganisationerna i djurvärlden är mycket ofullständig.
"Däremot är denna reklam fortfarande tillåten på annonspelare, i tidningar och tidskrifter osv.","Däremot vara denna reklam fortfarande tillåten på annonspelare, i tidningar och tidskrifter osv."
"Hon sprang ner för att möta dem, med det yviga, bruna håret fladdrande i luften.","Hon springa ner för att möta dem, med det yviga, bruna håret fladdrande i luften."
Man får aldrig ge sig.,Man få aldrig ge sig.
Filen upphör 150 meter söder om Ringvägen.,Filen upphöra 150 meter söder om Ringvägen.
"Här förelåg det symboliska förverkligandet av något som han hade trott på, eftersträvat och arbetat för under en avsevärd del av sitt liv:","Här föreligga det symboliska förverkligandet av något som han hade trott på, eftersträvat och arbetat för under en avsevärd del av sitt liv:"
"Jo, det stämmer visserligen att amerikanarna tidigt (= under femtiotalet) gjorde omfattande undervisningsexperiment.","Jo, det stämma visserligen att amerikanarna tidigt (= under femtiotalet) gjorde omfattande undervisningsexperiment."
"En etisk fråga i detta sammanhang är, om polygami innebär att kvinnan får lägre människovärde än mannen: det går flera kvinnor på en man.","En etisk fråga i detta sammanhang vara, om polygami innebär att kvinnan får lägre människovärde än mannen: det går flera kvinnor på en man."
Mannen verkade ung – nästan bara pojken – men man vet aldrig riktigt med de där.,Mannen verka ung – nästan bara pojken – men man vet aldrig riktigt med de där.
Hur många är vi då?,Hur många vara vi då?
Det finns rostskyddsvätska (kostar ungefär en tia) på alla bensinstationer.,Det finnas rostskyddsvätska (kostar ungefär en tia) på alla bensinstationer.
Jag gick ner till matrummet och hittade vår tonåring vid matbordet.,Jag gå ner till matrummet och hittade vår tonåring vid matbordet.
Nu när han gett sig in i fallet Stillman insåg han att det var på sin plats med ett nytt anteckningsblock.,Nu när han gett sig in i fallet Stillman inse han att det var på sin plats med ett nytt anteckningsblock.
Far hade varit på invigningsfesten i Southampton och där träffat några män som han tyckte om och som hade tyckt om honom.,Far ha varit på invigningsfesten i Southampton och där träffat några män som han tyckte om och som hade tyckt om honom.
För detta har man använt jästsvampar och vissa bakterier.,För detta ha man använt jästsvampar och vissa bakterier.
"Ser man nu till föräldrarnas behov så behöver det inte råda något motsatsförhållande där, vilken väg de än väljer, om samhället skapar former för att ta hand om barnen som är friare och smidigare än de vi nu har.","se man nu till föräldrarnas behov så behöver det inte råda något motsatsförhållande där, vilken väg de än väljer, om samhället skapar former för att ta hand om barnen som är friare och smidigare än de vi nu har."
Den längre medellivslängden - i förening med allt tidigare äktenskap - har gjort den livslånga monogamin till ett allt svårare ideal att leva upp till.,Den längre medellivslängden - i förening med allt tidigare äktenskap - ha gjort den livslånga monogamin till ett allt svårare ideal att leva upp till.
"Han monterade själv in kattluckan i sovrumsdörren, så att små mängder mat kunde skjutas in genom den tre gånger om dagen.","Han montera själv in kattluckan i sovrumsdörren, så att små mängder mat kunde skjutas in genom den tre gånger om dagen."
Olika samhällsorgan har uppgifter på bostadsområdet.,Olika samhällsorgan ha uppgifter på bostadsområdet.
"Ja, den är er, sa Quinn.","Ja, den vara er, sa Quinn."
Så ni ska ditut ni.,Så ni skola ditut ni.
Jag avbröt honom igen.,Jag avbryta honom igen.
"De relativt få, fasta och entydiga normer som styrde samlevnaden i det statiska samhället räcker inte längre i dagens sammansatta, skiftande och ständigt föränderliga tillvaro.","De relativt få, fasta och entydiga normer som styra samlevnaden i det statiska samhället räcker inte längre i dagens sammansatta, skiftande och ständigt föränderliga tillvaro."
"Ja, jag tror det.","Ja, jag tro det."
Något av det samma kan vi studera där zigenarna ännu lever i sina ursprungliga storfamiljer.,Något av det samma kunna vi studera där zigenarna ännu lever i sina ursprungliga storfamiljer.
Två ändringsförslag från min grupp vill jag också kommentera.,Två ändringsförslag från min grupp vilja jag också kommentera.
"Eleverna behöver en morot, sade Bengt Silfverberg.","Eleverna behöva en morot, sade Bengt Silfverberg."
"Eftersom den har en mera förödande effekt på den sjukes själsliv, är den ännu allvarligare.","Eftersom den ha en mera förödande effekt på den sjukes själsliv, är den ännu allvarligare."
Det gäller för männen att inte dra några förhastade slutsatser om sitt eget handlag.,Det gälla för männen att inte dra några förhastade slutsatser om sitt eget handlag.
Mannen såg sig hastigt om och sänkte rösten.,Mannen se sig hastigt om och sänkte rösten.
På nästa sida läser du om hur det går till.,På nästa sida läsa du om hur det går till.
"Han gick bortåt hundra meter längs vägen, och när han mötte en man på cykel hälsade han på honom på det språk som hade kommit tillbaka till honom medan han låg i rummet.","Han gå bortåt hundra meter längs vägen, och när han mötte en man på cykel hälsade han på honom på det språk som hade kommit tillbaka till honom medan han låg i rummet."
