grammatical,ungrammatical
Olyckligtvis motstod han alla försök från min mors sida att få honom att visa sin duglighet på andra områden.,Olyckligtvis motstå han alla försök från min mors sida att få honom att visa sin duglighet på andra områden.
Du ändrar layout genom att flytta fälten till fördefinierade släppområden i pivottabellvyns arbetsyta.,Du ändra layout genom att flytta fälten till fördefinierade släppområden i pivottabellvyns arbetsyta.
"För att friställa kapital, material och arbetskraft till sådan byggnation som anses mest samhällsnyttig, finns lagstiftning om igångsättningstillstånd för ur samhällets synpunkt mindre angelägna byggen.","För att friställa kapital, material och arbetskraft till sådan byggnation som anses mest samhällsnyttig, finnas lagstiftning om igångsättningstillstånd för ur samhällets synpunkt mindre angelägna byggen."
"Såg ni matchen ikväll, man?","se ni matchen ikväll, man?"
Och i Värmland levererar ett skalningsföretag potatisen doppad i askorbinsyra i stället.,Och i Värmland leverera ett skalningsföretag potatisen doppad i askorbinsyra i stället.
"Bäst tjänar byråkrater, utredare och administratörer.","Bäst tjäna byråkrater, utredare och administratörer."
Motsvarande siffra i industriländerna är 15-20 procent.,Motsvarande siffra i industriländerna vara 15-20 procent.
"Han är en lidelsefull bokälskare, han vill diskutera amerikansk litteratur och få höra underbara saker av mig.","Han vara en lidelsefull bokälskare, han vill diskutera amerikansk litteratur och få höra underbara saker av mig."
"De tyska turisterna hade rest hem, badhytterna var igenspikade.","De tyska turisterna ha rest hem, badhytterna var igenspikade."
"Tja, känner jag henne rätt så är festligheterna säkert överståndna när hon tror sig våga anförtro babyn åt Venetia.","Tja, känna jag henne rätt så är festligheterna säkert överståndna när hon tror sig våga anförtro babyn åt Venetia."
"Du skall nämligen inte bara skaffa dig vissa kunskaper, du skall också lära dig leva ihop med dina kamrater och så småningom sammangjutas med dem till ett förband.","Du skola nämligen inte bara skaffa dig vissa kunskaper, du skall också lära dig leva ihop med dina kamrater och så småningom sammangjutas med dem till ett förband."
Följande bild visar datadispositionen för sidan Order.,Följande bild visa datadispositionen för sidan Order.
Och hälften av landets hushåll saknar bil.,Och hälften av landets hushåll sakna bil.
"Harry väntade en minut för den händelse han skulle komma tillbaka och smög sedan så tyst han kunde ut ur skåpet, förbi glasmontrarna och vidare ut genom butiksdörren.","Harry vänta en minut för den händelse han skulle komma tillbaka och smög sedan så tyst han kunde ut ur skåpet, förbi glasmontrarna och vidare ut genom butiksdörren."
Vintergatan går genom magen,Vintergatan gå genom magen
Tjuren av europeisk bison märker ut sitt revir genom att med hornen barka av ett stycke från trädstammen.,Tjuren av europeisk bison märka ut sitt revir genom att med hornen barka av ett stycke från trädstammen.
Alltid finns en större andel kvinnor bland de lägst avlönade och med de minst bestämmande funktionerna.,Alltid finnas en större andel kvinnor bland de lägst avlönade och med de minst bestämmande funktionerna.
Men fartygen ville inte se åt mig.,Men fartygen vilja inte se åt mig.
Maktkampen inom EEC gynnar Sverige.,Maktkampen inom EEC gynna Sverige.
"Jag misstänker att det inte finns någon hel bild, bara fragment.","Jag misstänka att det inte finns någon hel bild, bara fragment."
Han hade aldrig nämnt sitt bankkonto hos Gringotts för familjen Dursley. Han var inte säker på att de skulle hysa lika stor avsky för en stor hög med guld som de gjorde för allting annat i trollkarlsvärlden.,Han ha aldrig nämnt sitt bankkonto hos Gringotts för familjen Dursley. Han var inte säker på att de skulle hysa lika stor avsky för en stor hög med guld som de gjorde för allting annat i trollkarlsvärlden.
"En lång kö ringlade ända bort till bakre änden av affären, där Gyllenroy Lockman satt och signerade sina böcker.","En lång kö ringla ända bort till bakre änden av affären, där Gyllenroy Lockman satt och signerade sina böcker."
"Jag föreställde mig henne: arg, självsäker, redo att ta strid med mig och ge mig tillbaka med samma mynt.","Jag föreställa mig henne: arg, självsäker, redo att ta strid med mig och ge mig tillbaka med samma mynt."
Men allt detta är på något sätt yttre ting.,Men allt detta vara på något sätt yttre ting.
Skolk är ju sällan en isolerad företeelse.,Skolk vara ju sällan en isolerad företeelse.
Äktenskapet uppfattas som en bild - ikon - av gudomliga förhållanden och är därför i princip oupplösligt.,Äktenskapet uppfattas som en bild - ikon - av gudomliga förhållanden och vara därför i princip oupplösligt.
Socialt beteende kan utgöra en barriär för korsning med andra arter.,Socialt beteende kunna utgöra en barriär för korsning med andra arter.
Det krävs stora förmögenheter för att giftorätten skall ge någon form av trygghet för den hemarbetande maken.,Det krävs stora förmögenheter för att giftorätten skola ge någon form av trygghet för den hemarbetande maken.
Han kan lugnt säga detta eftersom hans familj kom till Frankrike på sextonhundratalet.,Han kunna lugnt säga detta eftersom hans familj kom till Frankrike på sextonhundratalet.
Vad ligger det för svårighet i det?,Vad ligga det för svårighet i det?
Årsmedeltalet har stigit från 110000 vid de fyra mätningarna 1962 till 170000 vid motsvarande tidpunkt 1969.,Årsmedeltalet ha stigit från 110000 vid de fyra mätningarna 1962 till 170000 vid motsvarande tidpunkt 1969.
Det kan jag lugnt räkna med.,Det kunna jag lugnt räkna med.
Han rådde för eldsvådan påstods det; hur det nu må ha varit med den saken så skrek han ohyggligt.,Han råda för eldsvådan påstods det; hur det nu må ha varit med den saken så skrek han ohyggligt.
Men han är väl i stan nu?,Men han vara väl i stan nu?
Mycket skall pressas in i den dubbelarbetande kvinnans arbetsdag.,Mycket skola pressas in i den dubbelarbetande kvinnans arbetsdag.
Om vi helt kastar om rollerna får vi i stället ett renodlat matriarkat - något sådant har sannolikt aldrig förekommit i verkligheten.,Om vi helt kasta om rollerna får vi i stället ett renodlat matriarkat - något sådant har sannolikt aldrig förekommit i verkligheten.
"Från Gai-Hinnom för han mig upp till en av kareernas forna begravningsplatser, där man själv kan se detta uppgående.","Från Gai-Hinnom föra han mig upp till en av kareernas forna begravningsplatser, där man själv kan se detta uppgående."
"När han gick över tröskeln och in i lägenheten kände han att han blev alldeles tom inombords, som hade hans hjärna plötsligt stängts av.","När han gå över tröskeln och in i lägenheten kände han att han blev alldeles tom inombords, som hade hans hjärna plötsligt stängts av."
"För svenska medborgare som är födda 1896-1923 gäller särskilda regler, se ATP de första åren, sid 7.","För svenska medborgare som vara födda 1896-1923 gäller särskilda regler, se ATP de första åren, sid 7."
Vigseln blev en bekräftelse på att äktenskapet redan påbörjats.,Vigseln bli en bekräftelse på att äktenskapet redan påbörjats.
Litet senare sjöng Odaras kvinna den nya nationalsången med sin vackra altröst. Den kraftiga magen dallrade under klänningen.,Litet senare sjunga Odaras kvinna den nya nationalsången med sin vackra altröst. Den kraftiga magen dallrade under klänningen.
Den stora skalningsindustrin tar vara på de substanserna.,Den stora skalningsindustrin ta vara på de substanserna.
Jag tog itu med arbetet dagen därpå och vände därmed så att säga ryggen åt stationen.,Jag ta itu med arbetet dagen därpå och vände därmed så att säga ryggen åt stationen.
Jag har inte tänkt på de här frågorna så mycket tidigare - i varje fall har jag inte tänkt att jag skulle kunna ändra på det som jag eventuellt har kritiserat.,Jag ha inte tänkt på de här frågorna så mycket tidigare - i varje fall har jag inte tänkt att jag skulle kunna ändra på det som jag eventuellt har kritiserat.
"Omkring året börjar en del barn ta de första stegen, men de flesta brukar inte gå förrän några månader senare.","Omkring året börja en del barn ta de första stegen, men de flesta brukar inte gå förrän några månader senare."
Sju miljarder människor på jorden kan betyda drastiska förändringar i klimatet.,Sju miljarder människor på jorden kunna betyda drastiska förändringar i klimatet.
"Jag slår opp en martini åt Dorothy också, det kan kanske locka hit henne.","Jag slå opp en martini åt Dorothy också, det kan kanske locka hit henne."
Ni begär för mycket.,Ni begära för mycket.
Det ökar med 20 kr i månaden för varje barn utöver ett.,Det öka med 20 kr i månaden för varje barn utöver ett.
"Ordet är ert, herr van Miert.","Ordet vara ert, herr van Miert."
Harry Potter måste säga att han inte ska fara tillbaka till skolan,Harry Potter måste säga att han inte skola fara tillbaka till skolan
"De rapporter som föreligger har trots detta motiverat en planmässig forskning, bl a på lasarettet i Lund, ett projekt där både psykiater, neurologer, neurokirurger och röntgenologer är engagerade.","De rapporter som föreligga har trots detta motiverat en planmässig forskning, bl a på lasarettet i Lund, ett projekt där både psykiater, neurologer, neurokirurger och röntgenologer är engagerade."
"Det officiella mönstret i USA, varifrån vi förr eller senare hämtar idealen för vårt beteende, visar knappast tecken på att kvinnan är på väg att vinna sin självständiga ställning vid sidan av och bredvid mannen.","Det officiella mönstret i USA, varifrån vi förr eller senare hämta idealen för vårt beteende, visar knappast tecken på att kvinnan är på väg att vinna sin självständiga ställning vid sidan av och bredvid mannen."
"Och det här, återtog Auster och vände sig till kvinnan, det här är min hustru Siri.","Och det här, återta Auster och vände sig till kvinnan, det här är min hustru Siri."
"Det är inte alltid lätt att få lugn omkring sig om man har flera småbarn i familjen - som kanske dessutom känner sig avundsjuka på den minste som får ha mamma alldeles för sig själv, men om matningen kan ordnas som en skön stund utan jäkt och brådska är det bäst för både mor och barn.","Det vara inte alltid lätt att få lugn omkring sig om man har flera småbarn i familjen - som kanske dessutom känner sig avundsjuka på den minste som får ha mamma alldeles för sig själv, men om matningen kan ordnas som en skön stund utan jäkt och brådska är det bäst för både mor och barn."
"Om en medlem visar utpräglat aggressivt, självständigt, initiativrikt, individuellt eller auktoritärt beteende, visar de övriga medlemmarna i gruppen mindre av samma beteende än de gör i andra situationer.","Om en medlem visa utpräglat aggressivt, självständigt, initiativrikt, individuellt eller auktoritärt beteende, visar de övriga medlemmarna i gruppen mindre av samma beteende än de gör i andra situationer."
"- Jag är själv inte särskilt villig att dra långtgående slutsatser ur materialet, säger Åke Nilsson.","- Jag vara själv inte särskilt villig att dra långtgående slutsatser ur materialet, säger Åke Nilsson."
"Och till slut sjönk solen i sin omärkligt lutande bana mot horisonten och skiftade från vitglöd till matt rött, utan strålar och utan värme, som om hon hållit på att slockna, dödsmärkt vid beröringen med det mörker som ruvade över ett människomyller.","Och till slut sjunka solen i sin omärkligt lutande bana mot horisonten och skiftade från vitglöd till matt rött, utan strålar och utan värme, som om hon hållit på att slockna, dödsmärkt vid beröringen med det mörker som ruvade över ett människomyller."
"Detta innebär inte att förhållandena är oförändrade i andra länder, som exempel kan nämnas den nya synen på skilsmässa i Italien.","Detta innebära inte att förhållandena är oförändrade i andra länder, som exempel kan nämnas den nya synen på skilsmässa i Italien."
"Ramvillkoren har ändrats på några punkter, och andra är oförändrade.","Ramvillkoren ha ändrats på några punkter, och andra är oförändrade."
Om du har kostnader för resor till och från doktorn eller sjukhuset får du ersättning från försäkringskassan efter samma regler som tidigare.,Om du ha kostnader för resor till och från doktorn eller sjukhuset får du ersättning från försäkringskassan efter samma regler som tidigare.
"I dessa fall då orsaken alltså inte är den vanliga höggradig åderförkalkning, finns chansen att återföra patienten till ett normalt liv genom en operation av det slag som återges på skissen här intill","I dessa fall då orsaken alltså inte vara den vanliga höggradig åderförkalkning, finns chansen att återföra patienten till ett normalt liv genom en operation av det slag som återges på skissen här intill"
"I den extremt patriarkaliska familjen är en man, i regel den äldste, den maktutövande.","I den extremt patriarkaliska familjen vara en man, i regel den äldste, den maktutövande."
"Denna predestination till en speciell uppgift är kvinnans biologiska tragedi, som man ville bryta genom att överföra barnavården på kollektivet.","Denna predestination till en speciell uppgift vara kvinnans biologiska tragedi, som man ville bryta genom att överföra barnavården på kollektivet."
"Den röda, första delen tycks ha varit lättast.","Den röda, första delen tyckas ha varit lättast."
Kön heter på latin sexus.,Kön heta på latin sexus.
"Praktisk yrkesorientering (pryo), dvs praktik på en arbetsplats, skall alla elever i årskurs 9 ha under två veckor.","Praktisk yrkesorientering (pryo), dvs praktik på en arbetsplats, skola alla elever i årskurs 9 ha under två veckor."
"De besvaras ibland med påståendet, att äktenskapet är en ren privatsak, som inte angår samhället.","De besvaras ibland med påståendet, att äktenskapet vara en ren privatsak, som inte angår samhället."
"Södra stambanan passerar således varken genom Jönköping, Växjö, Kristianstad eller Hälsingborg utan mitt emellan dessa gamla städer.","Södra stambanan passera således varken genom Jönköping, Växjö, Kristianstad eller Hälsingborg utan mitt emellan dessa gamla städer."
Alldeles i slutet av sista terminen hade Harry stått ansikte mot ansikte med ingen mindre än Lord Voldemort själv.,Alldeles i slutet av sista terminen ha Harry stått ansikte mot ansikte med ingen mindre än Lord Voldemort själv.
"Innan skymningen drog en ridå för skogen en bit därifrån brukade han ibland ströva ut, in i solljuset, vilket samlades som gyllene vatten i sänkan mellan ängarna, och skjuta en rapphöna.","Innan skymningen dra en ridå för skogen en bit därifrån brukade han ibland ströva ut, in i solljuset, vilket samlades som gyllene vatten i sänkan mellan ängarna, och skjuta en rapphöna."
Mitt i alltihop kunde Quinn inte låta bli att glädja sig åt detta.,Mitt i alltihop kunna Quinn inte låta bli att glädja sig åt detta.
"Om du vill återställa Access 2000-versionen av sidan tar du bort den konverterade filen, ändrar tillbaka namnet på säkerhetskopian och ansluter sidan till databasen.","Om du vilja återställa Access 2000-versionen av sidan tar du bort den konverterade filen, ändrar tillbaka namnet på säkerhetskopian och ansluter sidan till databasen."
Dom äter opp skolans kålhuven.,Dom äta opp skolans kålhuven.
Om jag bara kunde få släppa ut henne på natten,Om jag bara kunna få släppa ut henne på natten
Jag tror att vi med denna hierarki har löst en stor del av de små och medelstora företagens problem.,Jag tro att vi med denna hierarki har löst en stor del av de små och medelstora företagens problem.
Dessutom är det många i u-länderna som slutar skolan efter ett par års dålig undervisning.,Dessutom vara det många i u-länderna som slutar skolan efter ett par års dålig undervisning.
Fäderna utväljer äktenskapspartner åt sina barn och även brudköp förekommer.,Fäderna utvälja äktenskapspartner åt sina barn och även brudköp förekommer.
Han var precis på väg att kravla sig tillbaka upp på byrån när morbror Vernon bultade på den upplåsta dörren – och den for upp med en skräll.,Han vara precis på väg att kravla sig tillbaka upp på byrån när morbror Vernon bultade på den upplåsta dörren – och den for upp med en skräll.
"På ena sidan om sig hade han parken, grön i morgonsolen och med skarpa, snabbt förbiilande skuggor; på den andra sidan hade han Fricks konstmuseum, en vit, stram byggnad som tycktes överlämnad åt de döda.","På ena sidan om sig ha han parken, grön i morgonsolen och med skarpa, snabbt förbiilande skuggor; på den andra sidan hade han Fricks konstmuseum, en vit, stram byggnad som tycktes överlämnad åt de döda."
Den lilla tvågenerationsfamiljen går miste om mycket som fanns i forna tiders stora familjer med flera generationer.,Den lilla tvågenerationsfamiljen gå miste om mycket som fanns i forna tiders stora familjer med flera generationer.
En svart man i khakishorts (det brukade vara en vit man i vita strumpor) sprutade ett kvalmigt insektsmedel över passagerarnas huvuden mot eventuella moskiter eller tsetseflugor som kunde finnas i planet.,En svart man i khakishorts (det bruka vara en vit man i vita strumpor) sprutade ett kvalmigt insektsmedel över passagerarnas huvuden mot eventuella moskiter eller tsetseflugor som kunde finnas i planet.
"Men jag tror att orsakerna till många av våra samlevnadssvårigheter ligger djupare, är beroende av fundamentala byggstenar i vårt samhälle, i vår miljö.","Men jag tro att orsakerna till många av våra samlevnadssvårigheter ligger djupare, är beroende av fundamentala byggstenar i vårt samhälle, i vår miljö."
"Världen skälvde till, som hade dess klocka stannat, men i själva verket var det vårt eget fartyg som hade slagit sin maskin i back.","Världen skälva till, som hade dess klocka stannat, men i själva verket var det vårt eget fartyg som hade slagit sin maskin i back."
"Alla Harrys trolldomsböcker, hans trollstav, klädnader och den förnämsta kvasten av alla, Nimbus Tvåtusen, hade låsts in av morbror Vernon i en skrubb under trappan i samma ögonblick Harry kommit hem.","Alla Harrys trolldomsböcker, hans trollstav, klädnader och den förnämsta kvasten av alla, Nimbus Tvåtusen, ha låsts in av morbror Vernon i en skrubb under trappan i samma ögonblick Harry kommit hem."
Får vi alltså be arbetsgivarna om hänsyn till individernas egen dygnsrytm.,få vi alltså be arbetsgivarna om hänsyn till individernas egen dygnsrytm.
"Man kan vara fullkomligt säker på att profeten Jeremia har gått den här vägen, säger Shahar.","Man kunna vara fullkomligt säker på att profeten Jeremia har gått den här vägen, säger Shahar."
Det har emellertid uppstått strid om forskarnas juridiska och moraliska rätt att använda dessa droger på försökspersoner.,Det ha emellertid uppstått strid om forskarnas juridiska och moraliska rätt att använda dessa droger på försökspersoner.
Det är alltså riksdagen - och ytterst väljarna - som har det avgörande inflytandet på regeringens sammansättning och politik.,Det vara alltså riksdagen - och ytterst väljarna - som har det avgörande inflytandet på regeringens sammansättning och politik.
Man vänder sig till pastorsexpeditionen.,Man vända sig till pastorsexpeditionen.
En titt på nuvarande diskussioner i rådet understryker detta.,En titt på nuvarande diskussioner i rådet understryka detta.
"Att säga att väderkvarnar var riddare, att ett tvättfat var en hjälm, att dockor var riktiga människor?","Att säga att väderkvarnar vara riddare, att ett tvättfat var en hjälm, att dockor var riktiga människor?"
"Varje barn under 16 år får 225 kr i kvartalet som barnbidrag, alltså 900 kr per år.","Varje barn under 16 år få 225 kr i kvartalet som barnbidrag, alltså 900 kr per år."
"Professor Cabrols försök, som vi stöder, får oss att bryta overksamheten och komma ut ur osäkerheten.","Professor Cabrols försök, som vi stödja, får oss att bryta overksamheten och komma ut ur osäkerheten."
"HTML beskriver hur en webbsida ska se ut, medan XML definierar informationen och beskriver hur den ska struktureras.","HTML beskriva hur en webbsida ska se ut, medan XML definierar informationen och beskriver hur den ska struktureras."
Hur auktoriteten upplevs i stockholmsfamiljer kan vi läsa om i Gustav Jonssons och Anna-Lisa Kälvestens undersökning 222 stockholmspojkar (Uppsala 1964).,Hur auktoriteten upplevs i stockholmsfamiljer kunna vi läsa om i Gustav Jonssons och Anna-Lisa Kälvestens undersökning 222 stockholmspojkar (Uppsala 1964).
"De flesta värnpliktiga tillhör kategori F, som har 300 dagars grundutbildning.","De flesta värnpliktiga tillhöra kategori F, som har 300 dagars grundutbildning."
"En minoritet ställde sig dock positiv till satsen, och lustigt nog var det något vanligare bland kvinnorna: 21 procent mot 18 procent bland männen.","En minoritet ställa sig dock positiv till satsen, och lustigt nog var det något vanligare bland kvinnorna: 21 procent mot 18 procent bland männen."
Då säger någon att det inte kan dröja länge nu förrän ryssarna släpper Arafat.,Då säga någon att det inte kan dröja länge nu förrän ryssarna släpper Arafat.
Be henne sjunga! ropade Dando stolt.,Be henne sjunga! ropa Dando stolt.
Herrar Kahn och Bruce-Briggs påpekar inledningsvis att deras bok i grunden är en organisationsprodukt.,Herrar Kahn och Bruce-Briggs påpeka inledningsvis att deras bok i grunden är en organisationsprodukt.
I stället begav han sig till New York.,I stället bege han sig till New York.
"Medan QE2 så fylld av självförtroende gled fram över vattnet tänkte jag på Titanic, spöklik och övergiven där under oss, och någonstans där uppe, i det hemlighetsfulla mörkret, navigerade Dårarnas Skepp mellan stjärnorna.","Medan QE2 så fylld av självförtroende glida fram över vattnet tänkte jag på Titanic, spöklik och övergiven där under oss, och någonstans där uppe, i det hemlighetsfulla mörkret, navigerade Dårarnas Skepp mellan stjärnorna."
Möjligheten att få del av denna njutning har i vår tid ökats genom preventivmedelsteknik.,Möjligheten att få del av denna njutning ha i vår tid ökats genom preventivmedelsteknik.
Den som bestämmer mest hemma hos oss...,Den som bestämma mest hemma hos oss...
"Sir Reginald Harvey var styrelseordförande i ett konsortium som bestod av de tre gruvkoncessionsbolagen, och det var allmänt bekant att han i sin egenskap av personlig vän till Redvers Ledley, den mest impopuläre guvernör som territoriet någonsin haft, hade förmått guvernören att förbjuda gruvarbetarförbundet vid en tidpunkt då Mweta och Shinza utnyttjade det för att främja frihetsrörelsen.","Sir Reginald Harvey vara styrelseordförande i ett konsortium som bestod av de tre gruvkoncessionsbolagen, och det var allmänt bekant att han i sin egenskap av personlig vän till Redvers Ledley, den mest impopuläre guvernör som territoriet någonsin haft, hade förmått guvernören att förbjuda gruvarbetarförbundet vid en tidpunkt då Mweta och Shinza utnyttjade det för att främja frihetsrörelsen."
I stället visade det sig vara en ung man som var helt klädd i vitt och hade ett barns vitblonda hår.,I stället visa det sig vara en ung man som var helt klädd i vitt och hade ett barns vitblonda hår.
"Jag såg att ni skulle komma tillbaka, det stod en artikel i tidningen, min fru, Margot skickade den till mig i Schweiz, så jag antog att det var ni.","Jag se att ni skulle komma tillbaka, det stod en artikel i tidningen, min fru, Margot skickade den till mig i Schweiz, så jag antog att det var ni."
KPI berättar för oss hur mycket dyrare det har blivit att leva.,KPI berätta för oss hur mycket dyrare det har blivit att leva.
Hjälpbehovet skall ha uppstått innan pensionären fyller 63 år.,Hjälpbehovet skola ha uppstått innan pensionären fyller 63 år.
Dagerns finhet påverkar mig också.,Dagerns finhet påverka mig också.
Det enda försonande är idén.,Det enda försonande vara idén.
Ändå vet alla som arbetar på fältet att skolket tenderar att öka.,Ändå veta alla som arbetar på fältet att skolket tenderar att öka.
I positiv riktning för kvinnornas yrkesverksamhet verkar den jämställdhet mellan flickor och pojkar som råder inom skolan.,I positiv riktning för kvinnornas yrkesverksamhet verka den jämställdhet mellan flickor och pojkar som råder inom skolan.
Jag är min fars dotter.,Jag vara min fars dotter.
"Jämförelsen haltar, men jag är fullt i stånd att uppföra mig som en åttaarmad huvudfoting samtidigt som jag bedyrar oskulden hos mina två händer på bordet.","Jämförelsen halta, men jag är fullt i stånd att uppföra mig som en åttaarmad huvudfoting samtidigt som jag bedyrar oskulden hos mina två händer på bordet."
Det finns dock två grupper som står emot varandra.,Det finnas dock två grupper som står emot varandra.
"När hemproduktionen var omfattande och den ekonomiska funktionen därmed speciellt viktig, blev ekonomiska faktorer också avgörande för partnerval och familjesammanhållning.","När hemproduktionen vara omfattande och den ekonomiska funktionen därmed speciellt viktig, blev ekonomiska faktorer också avgörande för partnerval och familjesammanhållning."
