grammatical,ungrammatical
Det nya systemet gör att du redan i förväg vet vad det kostar att anlita läkare om du blir sjuk.,Det nya systemet gör att du redan i förväg vet vad kostar det att anlita läkare om du blir sjuk.
Bilköparen har rätt att veta vad han / hon lägger ner pengar på.,Bilköparen har rätt att veta vad lägger han / hon ner pengar på.
Att de fortfarande är medlemmar beror ofta på att de inte vet hur enkelt det är att gå ur.,Att de fortfarande är medlemmar beror ofta på att de inte vet hur enkelt är det att gå ur.
"Det gamla knepet att köra upp bilen mot garageväggen och kolla ljuset är värdelöst; då får du möjligen veta om båda strålkastarna lyser, men inte mycket mera.","Det gamla knepet att köra upp bilen mot garageväggen och kolla ljuset är värdelöst; då får du möjligen veta om lyser båda strålkastarna, men inte mycket mera."
Men varken Jerome Bayless eller någon annan vet alltså om hasarden kommer att ge någon utdelning.,Men varken Jerome Bayless eller någon annan vet alltså om kommer hasarden att ge någon utdelning.
"Och i väntan på vad över 700000 poströster ska betyda för regeringsinnehav och riksdagssammansättning är det naturligt att undra varför betänkandet från 1965 års valtekniska utredning, framlagt i fjol höst (SOU 1969:19) och innehållande just den datavalteknik som här redovisats, inte blev omsatt i praktiken till 1970 års val.","Och i väntan på vad över 700000 poströster ska betyda för regeringsinnehav och riksdagssammansättning är det naturligt att undra varför blev betänkandet från 1965 års valtekniska utredning, framlagt i fjol höst (SOU 1969:19) och innehållande just den datavalteknik som här redovisats, inte omsatt i praktiken till 1970 års val."
"Ännu mot slutet av veckan efter det stora valet, vet man inte säkert hur valresultatet blev.","Ännu mot slutet av veckan efter det stora valet, vet man inte säkert hur blev valresultatet."
"Kusin Ruth har lärt sig den nya matematiken, och frågar man henne vad sex gånger sex är svarar hon prompt:","Kusin Ruth har lärt sig den nya matematiken, och frågar man henne vad är sex gånger sex svarar hon prompt:"
"Och det är naturligt, att vi frågar oss, om just engiftet ger individerna största möjliga lycka och nytta.","Och det är naturligt, att vi frågar oss, om ger just engiftet individerna största möjliga lycka och nytta."
Sök förklara varför dessa fyndigheter inte har exploterats?,Sök förklara varför har dessa fyndigheter inte exploterats?
Jag vet inte vad de tycker hemma om detta.,Jag vet inte vad tycker de hemma om detta.
Det skulle för övrigt vara intressant att veta hur flickorna ser på maktförhållandet.,Det skulle för övrigt vara intressant att veta hur ser flickorna på maktförhållandet.
"Undersök i din egen stad, om du kan finna exempel på båda dessa typer av kvarter.","Undersök i din egen stad, om kan du finna exempel på båda dessa typer av kvarter."
"Andra frågar, varför sådana uppgifter skall höra till könsrollen, och menar, att pojkar har lika stor anledning som flickor att utbildas i textilslöjd och hemkunskap.","Andra frågar, varför skall sådana uppgifter höra till könsrollen, och menar, att pojkar har lika stor anledning som flickor att utbildas i textilslöjd och hemkunskap."
"Är det fråga om rätt och orätt, när man diskuterar, hur uppgifterna i familj och samhälle ska fördelas på könen, om över huvud taget fördelningen ska ta hänsyn till kön?","Är det fråga om rätt och orätt, när man diskuterar, hur ska uppgifterna i familj och samhälle fördelas på könen, om över huvud taget fördelningen ska ta hänsyn till kön?"
"Man kan också fråga, om det i ett polygamt förhållande är möjligt för mannen att ge sina hustrur samma omsorg, samma hänsyn, samma kärlek.","Man kan också fråga, om är det i ett polygamt förhållande möjligt för mannen att ge sina hustrur samma omsorg, samma hänsyn, samma kärlek."
Vi vet inte hur stor den dolda kriminaliteten är.,Vi vet inte hur stor är den dolda kriminaliteten.
I det andra fallet kan man fråga sig om inte den terapeutiska synen på familjen har sin grund i en underförstådd negativ uppfattning av samhället utanför den egna privata kretsen.,I det andra fallet kan man fråga sig om har inte den terapeutiska synen på familjen sin grund i en underförstådd negativ uppfattning av samhället utanför den egna privata kretsen.
Därefter började han fundera över vad Max Work skulle ha tänkt om han hade varit där.,Därefter började han fundera över vad skulle Max Work ha tänkt om han hade varit där.
Quinn visste inte vad han skulle göra.,Quinn visste inte vad skulle han göra.
Medan bilen slamrande körde genom parken i riktning mot de västra stadsdelarna såg Quinn ut genom rutan och funderade över om det var de här träden som Peter Stillman brukade betrakta under sina promenader ut i luften och ljuset.,Medan bilen slamrande körde genom parken i riktning mot de västra stadsdelarna såg Quinn ut genom rutan och funderade över om var det de här träden som Peter Stillman brukade betrakta under sina promenader ut i luften och ljuset.
Han undrade om Peter såg samma saker som han själv gjorde eller om världen såg annorlunda ut för honom.,Han undrade om såg Peter samma saker som han själv gjorde eller om världen såg annorlunda ut för honom.
Antingen visste Stillman vad han gjorde eller också visste han det inte.,Antingen visste Stillman vad gjorde han eller också visste han det inte.
Jag undrar om jag kan få prata med er. Det är ganska viktigt.,Jag undrar om kan jag få prata med er. Det är ganska viktigt.
Gång på gång frågar han sig om hans krönikör kommer att ge en riktig beskrivning av hans äventyr.,Gång på gång frågar han sig om kommer hans krönikör att ge en riktig beskrivning av hans äventyr.
Men ni har fortfarande inte förklarat hur det kommer sig att en man som Don Quijote bryter upp från sin lugna tillvaro för att ägna sig åt en så utstuderad form av bedrägeri.,Men ni har fortfarande inte förklarat hur kommer det sig att en man som Don Quijote bryter upp från sin lugna tillvaro för att ägna sig åt en så utstuderad form av bedrägeri.
Siri kan inte. Och jag vet inte hur man gör.,Siri kan inte. Och jag vet inte hur gör man.
"Quinn frågade om han fick försöka, och pojken kom fram och räckte över jojon till honom.","Quinn frågade om fick han försöka, och pojken kom fram och räckte över jojon till honom."
Medan han undersökte den hörde han hur pojken andades alldeles intill honom och iakttog varje hans rörelse.,Medan han undersökte den hörde han hur andades pojken alldeles intill honom och iakttog varje hans rörelse.
Han tryckte den och kände hur förfärande bräcklig hennes benstomme var. Han frågade om hennes namn var norskt.,Han tryckte den och kände hur förfärande bräcklig hennes benstomme var. Han frågade om var hennes namn norskt.
Slutligen ringde han televerket och frågade om det var något fel på telefonen.,Slutligen ringde han televerket och frågade om var det något fel på telefonen.
Quinn visste inte vad han skulle tro.,Quinn visste inte vad skulle han tro.
Jag frågar en av värdinnorna när jag kan räkna med att få en drink och hon utbrister irriterat: Gå tillbaka till er plats!,Jag frågar en av värdinnorna när kan jag räkna med att få en drink och hon utbrister irriterat: Gå tillbaka till er plats!
Min fru undrar roat varför jag beställde en koscherlunch.,Min fru undrar roat varför beställde jag en koscherlunch.
Ibland undrar jag om det är därför som världen har så svårt att fördra dem.,Ibland undrar jag om är det därför som världen har så svårt att fördra dem.
"De stängde in ugglan i färgskrubben medan de diskuterade vad de skulle göra med den, och på natten släppte John ut den.","De stängde in ugglan i färgskrubben medan de diskuterade vad skulle de göra med den, och på natten släppte John ut den."
Och du undrar om folk kommer att tala öppet med dig?,Och du undrar om kommer folk att tala öppet med dig?
"Tänk er hur det ska ha känts för befälhavaren på en ståtlig – vad hette det nu – trirem i Medelhavet som plötsligt fick order att bege sig norrut, i expressfart transporterades tvärs över de båda Gallierna, gavs befäl över en farkost av det slag som legionärerna – som måtte ha varit ett förbluffande händigt släkte – brukade snickra ihop, tydligen i hundratal, på ett par månader, om vi får tro vad vi läser.","Tänk er hur ska det ha känts för befälhavaren på en ståtlig – vad hette det nu – trirem i Medelhavet som plötsligt fick order att bege sig norrut, i expressfart transporterades tvärs över de båda Gallierna, gavs befäl över en farkost av det slag som legionärerna – som måtte ha varit ett förbluffande händigt släkte – brukade snickra ihop, tydligen i hundratal, på ett par månader, om vi får tro vad vi läser."
"Men för att kunna förstå dess verkan på mig måste ni i alla fall veta hur jag kom dit ut, vad jag såg, hur jag färdades uppför floden till den plats där jag träffade på den stackars mannen.","Men för att kunna förstå dess verkan på mig måste ni i alla fall veta hur kom jag dit ut, vad jag såg, hur jag färdades uppför floden till den plats där jag träffade på den stackars mannen."
Man frågar sig vad det blir av såna när de kommer inåt land.,Man frågar sig vad blir det av såna när de kommer inåt land.
Jag frågade mig vad jag hade där att göra nu när min båt var borta.,Jag frågade mig vad hade jag där att göra nu när min båt var borta.
Jag måste ibland fråga mig vad meningen var med alltihop.,Jag måste ibland fråga mig vad var meningen med alltihop.
"I den känsla av frigjordhet som den fysiska kontakten åstadkom sade han till Mweta: Jag vet inte riktigt vad vi talar om, och Mweta svarade: Dig... jag sa att vi väntar dig tillbaka, nu.","I den känsla av frigjordhet som den fysiska kontakten åstadkom sade han till Mweta: Jag vet inte riktigt vad talar vi om, och Mweta svarade: Dig... jag sa att vi väntar dig tillbaka, nu."
"Den lidelsefulla begynnelsen, den mångåriga öppenheten och förståelsen mellan dem borde ha gjort det naturligt att hon skulle veta vad han ville.","Den lidelsefulla begynnelsen, den mångåriga öppenheten och förståelsen mellan dem borde ha gjort det naturligt att hon skulle veta vad ville han."
"Så frågan om vad de egentligen talade om bestod i grund och botten av hennes dolda, undertryckta, indämda önskan att få veta om detta hus, detta liv i Wiltshire, detta liv – till sist – för honom tedde sig som det slutgiltiga, innerst inne.","Så frågan om vad de egentligen talade om bestod i grund och botten av hennes dolda, undertryckta, indämda önskan att få veta om tedde detta hus, detta liv i Wiltshire, detta liv – till sist – för honom sig som det slutgiltiga, innerst inne."
"Hon visste inte om också han kände det; och hon kunde inte försöka ta reda på det, för om det skulle visa sig att han inte gjorde det... hon hade ibland en förkänsla av att man som medelålders kunde finna att man på ett enda ögonblick hade mist allt: äkta man och älskare och vän, barn; det var som om de aldrig hade funnits eller som om man utan att själv veta om det hade gått ifrån dem och nu stod där lamslagen inför upptäckten.","Hon visste inte om kände också han det; och hon kunde inte försöka ta reda på det, för om det skulle visa sig att han inte gjorde det... hon hade ibland en förkänsla av att man som medelålders kunde finna att man på ett enda ögonblick hade mist allt: äkta man och älskare och vän, barn; det var som om de aldrig hade funnits eller som om man utan att själv veta om det hade gått ifrån dem och nu stod där lamslagen inför upptäckten."
"Jag vet hur envis du är, Festus...","Jag vet hur envis är du, Festus..."
Men Gud vet vad vi får sedan.,Men Gud vet vad får vi sedan.
"Ingen visste vad den hade för uppgift – en säkerhetsåtgärd nöjde sig en del med att gissa på, medan andra uppfattade den som en i största allmänhet lämplig företeelse, en symbol för framåtskridande, som är oskiljaktig vid alla handels- och industrimässor och jordbruksutställningar och följaktligen på något sätt naturligt sammanhörande med alla offentliga tillställningar.","Ingen visste vad hade den för uppgift – en säkerhetsåtgärd nöjde sig en del med att gissa på, medan andra uppfattade den som en i största allmänhet lämplig företeelse, en symbol för framåtskridande, som är oskiljaktig vid alla handels- och industrimässor och jordbruksutställningar och följaktligen på något sätt naturligt sammanhörande med alla offentliga tillställningar."
Vi visste inte heller vad vi skulle komma att ägna oss åt till sist.,Vi visste inte heller vad skulle vi komma att ägna oss åt till sist.
"Harry hade slunkit ur Voldemorts grepp en andra gång, men det hade varit nära ögat, och till och med nu, flera veckor senare, vaknade Harry alldeles kallsvettig på nätterna och undrade var Voldemort befann sig för närvarande, och mindes hans likbleka ansikte, hans vitt uppspärrade, galna ögon.","Harry hade slunkit ur Voldemorts grepp en andra gång, men det hade varit nära ögat, och till och med nu, flera veckor senare, vaknade Harry alldeles kallsvettig på nätterna och undrade var befann Voldemort sig för närvarande, och mindes hans likbleka ansikte, hans vitt uppspärrade, galna ögon."
Kan ni gissa vem jag såg hos Borgin & Burkes? sade Harry till Ron och Hermione då de klev uppför trappan till Gringotts.,Kan ni gissa vem såg jag hos Borgin & Burkes? sade Harry till Ron och Hermione då de klev uppför trappan till Gringotts.
"Far var emellertid inte okomplicerad, och han var fortfarande tillräckligt medveten för att vrida och vända på sin egen mask och fråga sig vad den föreställde.","Far var emellertid inte okomplicerad, och han var fortfarande tillräckligt medveten för att vrida och vända på sin egen mask och fråga sig vad föreställde den."
"Hon saknade rådighet, sådan var inte tillåten i hennes klass, och jag vet att farmor oroade sig över att hennes son hade hittat en fru som inte visste hur man kokade soppa på sillhuvuden.","Hon saknade rådighet, sådan var inte tillåten i hennes klass, och jag vet att farmor oroade sig över att hennes son hade hittat en fru som inte visste hur kokade man soppa på sillhuvuden."
Så sent som en vecka efter min födsel fortsatte han att fråga Hur mår han?,Så sent som en vecka efter min födsel fortsatte han att fråga Hur mår mår han?
Mycket ofta sa hon Hästen som för var basunstöt frustar: Huj! och jag funderade på vad det kunde vara för slags häst som gjorde så.,Mycket ofta sa hon Hästen som för var basunstöt frustar: Huj! och jag funderade på vad kunde det vara för slags häst som gjorde så.
Medan hon talade satt jag och undrade varför Jove ville ha mig.,Medan hon talade satt jag och undrade varför ville Jove ha mig.
Och han citerar en amerikansk forskare som sökte förklara varför atomenergins folk driver på så hänsynslöst:,Och han citerar en amerikansk forskare som sökte förklara varför driver atomenergins folk på så hänsynslöst:
"Har vi någonsin frågat oss om människorna som arbetar med våra barn i daghem, lekskolor, skolor, är tillräckligt intresserade och inne i yrket att ta hand om våra barn?","Har vi någonsin frågat oss om är människorna som arbetar med våra barn i daghem, lekskolor, skolor, tillräckligt intresserade och inne i yrket att ta hand om våra barn?"
I stället bör man undersöka huruvida inte en registrering skulle kunna utgöra det konstitutiva momentet vid äktenskapets ingående.,I stället bör man undersöka huruvida skulle inte en registrering kunna utgöra det konstitutiva momentet vid äktenskapets ingående.
Man kan fråga sig hur dessa barn blir.,Man kan fråga sig hur blir dessa barn.
Man undrar bara varför han inte själv försöker delta i denna den största av uppgifter.,Man undrar bara varför försöker han inte själv delta i denna den största av uppgifter.
Man kan ju undra hur samlevnaden tar sig ut om den ena parten i ett äktenskap helhjärtat håller på husbondevälde och den andra på den likställighet som enligt svensk lag skall råda mellan makar.,Man kan ju undra hur tar samlevnaden sig ut om den ena parten i ett äktenskap helhjärtat håller på husbondevälde och den andra på den likställighet som enligt svensk lag skall råda mellan makar.
Mookie är bra men han är oerfaren och de vet inte ens vem de ska sätta på högerflygeln.,Mookie är bra men han är oerfaren och de vet inte ens vem ska de sätta på högerflygeln.
Han kunde omöjligt förklara för sig själv varför han kände sig så tilltalad av just det blocket.,Han kunde omöjligt förklara för sig själv varför kände han sig så tilltalad av just det blocket.
Cervantes beskriver hur han av en slump hittade manuskriptet på en marknad i Toledo,Cervantes beskriver hur hittade han av en slump manuskriptet på en marknad i Toledo
Jag har lust att fråga honom varför den inte trycktes.,Jag har lust att fråga honom varför trycktes den inte.
"För övrigt ser Tatu inte ut att vara en människa som har någon lätt tillvaro, och jag undrar om jag egentligen bör fördärva hans middag i Jerusalem för honom i hans dagbok blir den förmodligen bokförd som en förtrollad afton i Le Proche Orient med en armenisk ärkebiskop.","För övrigt ser Tatu inte ut att vara en människa som har någon lätt tillvaro, och jag undrar om bör jag egentligen fördärva hans middag i Jerusalem för honom i hans dagbok blir den förmodligen bokförd som en förtrollad afton i Le Proche Orient med en armenisk ärkebiskop."
"Där fanns mycket rött – alltid en ögonfägnad därför att man vet att där uträttas en del verkligt gott arbete, en förbaskad massa blått, litet grönt, ett och annat penseldrag orange och, på ostkusten, en gredelin fläck för att markera var de famösa kulturapostlarna dricker det famösa lagerölet.","Där fanns mycket rött – alltid en ögonfägnad därför att man vet att där uträttas en del verkligt gott arbete, en förbaskad massa blått, litet grönt, ett och annat penseldrag orange och, på ostkusten, en gredelin fläck för att markera var dricker de famösa kulturapostlarna det famösa lagerölet."
"Det var precis som om jag hade blivit invigd i en sammansvärjning, något – jag vet inte hur jag ska säga – något lite skumt, och jag var glad när jag fick gå.","Det var precis som om jag hade blivit invigd i en sammansvärjning, något – jag vet inte hur ska jag säga – något lite skumt, och jag var glad när jag fick gå."
Jag kunde inte låta bli att en gång fråga honom vad han alls hade givit sig dit för.,Jag kunde inte låta bli att en gång fråga honom vad hade han alls givit sig dit för.
Ni vet hur det är just nu.,Ni vet hur är det just nu.
Jag undrar just om jag kommer så långt.,Jag undrar just om kommer jag så långt.
Men ingen tycktes ha sett till honom eller veta om han var eller hade varit i huvudstaden.,Men ingen tycktes ha sett till honom eller veta om var han eller hade varit i huvudstaden.
"Han vet vad han vill, men han är inte omedgörlig, inte alls...","Han vet vad vill han, men han är inte omedgörlig, inte alls..."
Du vet inte hur det är här.,Du vet inte hur är det här.
"De hade frågat Percy om han ville följa med, men han hade sagt att han var upptagen.","De hade frågat Percy om ville han följa med, men han hade sagt att han var upptagen."
"Jag önskar jag visste vad han håller på med, sade Fred med bekymrad min.","Jag önskar jag visste vad håller han på med, sade Fred med bekymrad min."
Jag visste inte vad detta betydde och när jag hade lärt mig att översätta det begrep jag det inte.,Jag visste inte vad betydde detta och när jag hade lärt mig att översätta det begrep jag det inte.
Resten av sitt intellekt gjorde hon sig av med vid giftermålet och kom aldrig på tanken att fråga min far vad han hade gjort av det.,Resten av sitt intellekt gjorde hon sig av med vid giftermålet och kom aldrig på tanken att fråga min far vad hade han gjort av det.
XML-syntaxen (märkena och deras placering i dokumentet) definierar och beskriver informationen i ett XML-dokument men anger inte hur den ska visas.,XML-syntaxen (märkena och deras placering i dokumentet) definierar och beskriver informationen i ett XML-dokument men anger inte hur ska den visas.
Quinn satt tyst en stund. Han lät blicken svepa över rummet utan att se något och försökte tänka ut hur han skulle börja.,Quinn satt tyst en stund. Han lät blicken svepa över rummet utan att se något och försökte tänka ut hur skulle han börja.
Det skulle förklara varför samtalet gick till er men inte varför de över huvud taget ville tala med mig.,Det skulle förklara varför gick samtalet till er men inte varför de över huvud taget ville tala med mig.
"Jaha, nog duger han därute, muttrade han och så frågade han med en viss iver om han fick ta mått av mitt huvud.","Jaha, nog duger han därute, muttrade han och så frågade han med en viss iver om fick han ta mått av mitt huvud."
"Han hade legat ute i nära tre år, och jag kunde längre fram inte låta bli att fråga honom hur han bar sig åt för att kunna ståta med sådana stärksaker.","Han hade legat ute i nära tre år, och jag kunde längre fram inte låta bli att fråga honom hur bar han sig åt för att kunna ståta med sådana stärksaker."
Jag skulle också gärna vilja veta hur ni ser på tidsplanerna.,Jag skulle också gärna vilja veta hur ser ni på tidsplanerna.
"En mustig stank av dött djur fläktade mot honom, som något slags gas, då och då medan han drack sitt te, och han steg upp och såg sig om, som han hade gjort så många gånger förut, och lika framgångslöst, för att undersöka om en råtta eller mullvad låg och ruttnade någonstans.","En mustig stank av dött djur fläktade mot honom, som något slags gas, då och då medan han drack sitt te, och han steg upp och såg sig om, som han hade gjort så många gånger förut, och lika framgångslöst, för att undersöka om låg en råtta eller mullvad och ruttnade någonstans."
Jag vet inte var i helvete han är nånstans.,Jag vet inte var i helvete är han nånstans.
Han vet vad han vill.,Han vet vad vill han.
"Om jag var tvungen att ta hand om dom engelskspråkiga sändningarna i morgon, så vet ni vad jag måste försöka klara mig med: en hop lambala- och ezenzeli-talande från lokalavdelningarna och några skollärare som har flytt från Sydafrika.","Om jag var tvungen att ta hand om dom engelskspråkiga sändningarna i morgon, så vet ni vad måste jag försöka klara mig med: en hop lambala- och ezenzeli-talande från lokalavdelningarna och några skollärare som har flytt från Sydafrika."
Medan de gick därifrån sade hon: Gissa vad jag heter! och tillade när han verkade generad:,Medan de gick därifrån sade hon: Gissa vad heter jag! och tillade när han verkade generad:
Mr Weasley ville gärna att Harry skulle sitta närmast honom vid middagsbordet så att han kunde bombardera honom med frågor om livet hos mugglarna och be honom förklara hur sådana saker som elkontakter och postväsende fungerade.,Mr Weasley ville gärna att Harry skulle sitta närmast honom vid middagsbordet så att han kunde bombardera honom med frågor om livet hos mugglarna och be honom förklara hur sådana fungerade saker som elkontakter och postväsende.
Alla vet hur berättelsen förändras när han får vattnet att krusas.,Alla vet hur förändras berättelsen när han får vattnet att krusas.
Jag vet inte vad jag gör.,Jag vet inte vad gör jag.
